Group,Keyword,Volume,Keyword Difficulty,CPC (USD),Competitive Density,Number of Results,Intent,SERP Features,Trend
falda,faldas animal print con tenis,10,,0.00,0.98,,,,"1.00,1.00,0.00,0.00,0.00,1.00,1.00,1.00,1.00,1.00,0.00,1.00"
falda,faldas animal print el corte ingles,10,,0.00,0.00,,,,"1.00,1.00,1.00,1.00,1.00,0.00,0.00,0.00,0.00,0.00,0.00,0.00"
falda,faldas animal print para niñas,10,,0.00,0.00,,,,"0.00,0.00,0.00,0.00,1.00,0.00,1.00,0.00,1.00,1.00,1.00,0.00"
falda,faldas animal print zara,10,,0.00,0.99,,,,"0.00,1.00,1.00,0.50,1.00,0.00,0.00,0.00,0.50,0.50,0.00,0.00"
falda,faldas en animal print,10,,0.00,0.00,,,,"0.00,0.00,0.00,0.00,0.00,1.00,0.00,1.00,1.00,0.00,0.00,0.00"
falda,faldas largas animal print,10,,0.00,1.00,,,,"1.00,0.75,1.00,0.50,0.25,0.00,0.00,0.50,0.50,0.00,0.00,0.00"
falda,look falda plisada animal print,10,,0.00,1.00,,,,"1.00,1.00,1.00,0.00,1.00,0.00,0.00,0.00,0.00,1.00,0.00,1.00"
falda,outfit con falda animal print,10,,0.00,1.00,,,,"0.00,0.00,0.00,0.00,0.00,1.00,0.00,0.00,0.00,0.50,1.00,1.00"
falda,outfit falda animal print larga,10,,0.00,1.00,,,,"0.00,0.50,0.00,0.00,1.00,1.00,1.00,1.00,1.00,1.00,1.00,1.00"
falda,zara falda midi animal print,10,,0.00,0.26,,,,"1.00,1.00,0.00,1.00,1.00,1.00,0.00,0.00,0.00,0.00,0.00,1.00"
falda,zara falda roja animal print,10,,0.00,0.00,,,,"0.00,1.00,1.00,0.00,1.00,0.00,0.00,0.00,0.00,0.00,0.00,0.00"
zapatos,zapatos animal print,590,19,0.13,1.00,15900000,Informational,"Reviews, Image, Image pack, Video, Related searches","0.20,0.67,1.00,0.76,0.55,0.45,0.55,0.55,0.45,0.30,0.20,0.10"
zapatos,zapatos animal print zara,320,25,0.00,0.99,56,Informational,"Reviews, Image, Image pack, Related searches","0.19,0.44,1.00,0.66,0.44,0.66,0.36,0.54,0.44,0.23,0.15,0.12"
zapatos,zapatos animal print mango,210,15,5.78,1.00,54,Informational,"Reviews, Image, Image pack","0.23,0.66,1.00,1.00,0.82,0.53,0.43,0.66,0.43,0.23,0.23,0.23"
zapatos,como combinar un vestido animal print con zapatos,170,6,0.00,0.05,75,Informational,"Reviews, Indented, Image, Image pack, Video, People also ask","0.53,1.00,0.81,0.81,0.65,0.28,0.28,0.43,0.43,0.53,0.21,0.28"
zapatos,zapatos animal print mujer,170,24,0.14,1.00,16600000,Informational,"Reviews, Indented, Image, Image pack, Video, Related searches","0.10,0.54,1.00,0.35,0.22,0.81,0.18,0.29,0.14,0.22,0.06,0.04"
zapatos,zapatos mujer animal print,170,18,0.00,1.00,16000000,Informational,"Reviews, Image, Image pack, Video, Related searches","0.34,0.06,0.12,0.80,0.80,0.80,1.00,1.00,1.00,0.34,0.12,0.15"
zapatos,zapatos animal print marypaz,140,20,0.00,1.00,27,Informational,"Image, Image pack, People also ask, Related searches, Ads bottom","0.15,0.53,0.81,1.00,0.81,0.53,0.43,0.53,0.43,0.21,0.15,0.12"
zapatos,zapatos animal print el corte ingles,90,26,0.00,1.00,50,"Informational, Transactional","Image, Image pack, Related searches","0.28,0.50,1.00,1.00,0.78,0.64,1.00,1.00,0.78,0.64,0.35,0.28"
zapatos,como combinar zapatos animal print con ropa,70,11,0.00,0.00,58,Informational,"Image, Image pack, Video, People also ask, Related searches","0.14,0.79,0.79,0.79,1.00,0.14,0.14,0.79,0.14,0.14,0.14,0.14"
zapatos,zapato salon animal print,70,16,0.00,0.95,88,Informational,"Reviews, Indented, Image, Image pack, Video, Related searches","0.14,0.78,1.00,0.21,0.64,0.64,0.64,0.64,0.50,0.14,0.14,0.14"
zapatos,zapato tacon animal print,70,17,0.00,1.00,96,Informational,"Reviews, Image, Image pack, Video, Related searches","0.49,1.00,1.00,0.79,0.49,0.64,0.64,0.64,0.49,0.13,0.13,0.13"
zapatos,zapatos animal print el corte inglés,70,25,0.00,1.00,48,"Informational, Transactional","Image, Image pack, Related searches","0.00,0.50,1.00,0.64,0.50,0.50,0.50,0.64,0.78,0.35,0.14,0.14"
zapatos,zapatos salon animal print,70,16,0.00,0.95,86,Informational,"Reviews, Indented, Image, Image pack, Video, Related searches, Popular products","0.13,0.79,1.00,1.00,0.64,0.64,0.64,0.64,0.49,0.13,0.13,0.13"
zapatos,zapatos tacon animal print,70,19,0.00,1.00,92,Informational,"Reviews, Image, Image pack, Video, Related searches","0.49,0.79,1.00,0.79,0.36,0.64,0.79,0.79,0.49,0.13,0.13,0.13"
zapatos,zapato animal print,40,21,0.13,1.00,11700000,Informational,"Reviews, Indented, Image, Image pack, Video, Related searches","0.18,0.45,1.00,0.27,0.27,0.27,0.45,0.09,0.27,0.36,0.18,0.00"
zapatos,zapatos animal print 2022,30,,0.00,0.00,,,,"0.00,0.27,1.00,1.00,0.27,0.18,0.18,0.18,0.18,0.00,0.00,0.00"
zapatos,zapatos animal print mujer outfit,30,,0.00,0.00,,,,"0.00,1.00,0.50,0.14,0.14,0.14,0.14,0.14,0.14,0.14,0.00,0.00"
zapatos,zapatos animal print zalando,30,,0.00,0.95,,,,"0.18,0.18,0.18,0.18,0.18,1.00,0.18,0.18,0.18,0.18,0.18,0.18"
zapatos,zapatos destalonados animal print,30,,0.00,1.00,,,,"0.18,0.18,0.18,0.18,0.18,0.18,0.18,0.18,1.00,0.18,0.18,0.18"
zapatos,zapatos planos animal print,30,,0.00,1.00,,,,"0.17,0.17,1.00,0.27,0.17,0.17,0.17,0.17,0.17,0.17,0.17,0.17"
zapatos,animal print zapatos,20,,0.13,1.00,,,,"0.00,0.66,1.00,0.33,0.33,0.33,0.66,0.33,0.66,0.66,0.33,0.33"
zapatos,asos zapatos animal print,20,,0.00,0.00,,,,"1.00,1.00,1.00,1.00,1.00,1.00,1.00,1.00,0.00,0.00,1.00,1.00"
zapatos,combinar zapatos animal print mujer,20,,0.00,0.00,,,,"1.00,0.00,1.00,1.00,1.00,1.00,1.00,1.00,1.00,1.00,1.00,0.00"
zapatos,combinar zapatos animal print serpiente,20,,0.00,0.61,,,,"1.00,1.00,1.00,1.00,1.00,1.00,1.00,1.00,1.00,1.00,1.00,1.00"
zapatos,como combinar zapatos animal print,20,,0.00,0.01,,,,"1.00,1.00,1.00,1.00,1.00,1.00,1.00,1.00,1.00,1.00,1.00,1.00"
zapatos,como combinar zapatos animal print con vestido,20,,0.00,0.00,,,,"1.00,1.00,1.00,1.00,1.00,1.00,1.00,1.00,1.00,1.00,0.00,0.00"
zapatos,comprar zapatos animal print,20,,0.00,0.00,,,,"0.00,1.00,1.00,1.00,1.00,1.00,1.00,1.00,1.00,1.00,0.00,0.00"
zapatos,look con zapatos animal print,20,,0.00,0.24,,,,"1.00,1.00,1.00,1.00,1.00,1.00,1.00,1.00,1.00,0.00,1.00,1.00"
zapatos,look con zapatos animal print mujer,20,,0.00,0.00,,,,"1.00,1.00,1.00,1.00,1.00,1.00,1.00,1.00,1.00,1.00,1.00,0.00"
zapatos,look zapatos animal print,20,,0.00,0.86,,,,"1.00,1.00,1.00,1.00,1.00,1.00,1.00,1.00,1.00,1.00,1.00,1.00"
zapatos,mango zapatos animal print,20,,0.00,0.50,,,,"0.00,1.00,1.00,1.00,1.00,1.00,1.00,1.00,1.00,1.00,1.00,1.00"
zapatos,outfit con zapatos animal print,20,,0.00,0.57,,,,"1.00,1.00,1.00,1.00,1.00,1.00,1.00,1.00,1.00,1.00,1.00,1.00"
zapatos,outfit zapatos animal print,20,,0.00,0.64,,,,"1.00,1.00,1.00,1.00,1.00,1.00,1.00,1.00,1.00,1.00,1.00,1.00"
zapatos,que zapatos usar con vestido animal print,20,,0.00,0.86,,,,"1.00,1.00,1.00,1.00,1.00,1.00,1.00,1.00,1.00,0.00,1.00,1.00"
zapatos,vestido animal print con que zapatos,20,,0.00,0.91,,,,"1.00,1.00,1.00,1.00,1.00,1.00,0.00,1.00,0.00,1.00,0.00,1.00"
zapatos,vestido animal print con zapatos rojos,20,,0.00,0.00,,,,"1.00,1.00,1.00,1.00,1.00,0.00,1.00,1.00,1.00,1.00,1.00,0.00"
zapatos,vestido rojo con zapatos animal print,20,,0.00,1.00,,,,"1.00,1.00,1.00,1.00,1.00,0.00,1.00,1.00,1.00,1.00,0.00,1.00"
zapatos,zapato mujer animal print,20,,0.00,1.00,,,,"0.00,0.00,0.00,0.00,0.00,1.00,0.00,0.04,0.00,0.00,0.00,0.00"
zapatos,zapato plano animal print,20,,0.00,1.00,,,,"0.67,0.67,1.00,0.67,0.67,0.67,0.67,0.67,0.67,0.67,0.67,0.67"
zapatos,zapatos animal print amazon,20,,0.00,1.00,,,,"1.00,1.00,1.00,1.00,1.00,1.00,1.00,1.00,1.00,1.00,1.00,1.00"
zapatos,zapatos animal print cebra,20,,0.00,1.00,,,,"1.00,1.00,1.00,1.00,1.00,1.00,1.00,1.00,1.00,1.00,1.00,1.00"
zapatos,zapatos animal print como combinarlos,20,,0.00,0.01,,,,"0.00,0.50,0.50,1.00,1.00,1.00,1.00,1.00,1.00,1.00,1.00,1.00"
zapatos,zapatos animal print comprar,20,,0.00,0.00,,,,"0.00,1.00,1.00,1.00,1.00,1.00,1.00,1.00,1.00,1.00,0.00,0.00"
zapatos,zapatos animal print hombre,20,,0.00,1.00,,,,"1.00,1.00,1.00,1.00,1.00,1.00,1.00,1.00,1.00,1.00,1.00,1.00"
zapatos,zapatos animal print leopardo,20,,0.00,0.00,,,,"1.00,1.00,1.00,1.00,1.00,1.00,0.00,1.00,1.00,1.00,0.00,0.00"
zapatos,zapatos animal print outfit,20,,0.00,1.00,,,,"0.00,0.00,1.00,1.00,1.00,1.00,1.00,1.00,1.00,1.00,1.00,1.00"
zapatos,zapatos animal print rojo,20,,0.00,1.00,,,,"1.00,1.00,1.00,0.00,1.00,1.00,1.00,1.00,1.00,1.00,1.00,1.00"
zapatos,zapatos animal print serpiente,20,,0.00,1.00,,,,"1.00,1.00,1.00,1.00,1.00,1.00,1.00,1.00,1.00,1.00,1.00,1.00"
zapatos,zapatos animal print stradivarius,20,,0.00,0.71,,,,"0.00,1.00,1.00,1.00,1.00,1.00,1.00,1.00,1.00,1.00,0.00,1.00"
zapatos,zapatos animal print tacon,20,,0.00,1.00,,,,"1.00,1.00,1.00,1.00,1.00,1.00,1.00,1.00,1.00,1.00,1.00,1.00"
zapatos,zapatos animal print tacon ancho,20,,0.00,1.00,,,,"0.00,1.00,0.00,1.00,1.00,1.00,1.00,1.00,1.00,1.00,1.00,1.00"
zapatos,zapatos con animal print,20,,0.00,0.00,,,,"1.00,1.00,1.00,1.00,1.00,1.00,1.00,1.00,1.00,1.00,1.00,0.00"
zapatos,zapatos de animal print para mujer,20,,0.00,0.91,,,,"1.00,1.00,1.00,1.00,1.00,1.00,1.00,1.00,1.00,1.00,1.00,1.00"
zapatos,zapatos de mujer animal print,20,,0.00,1.00,,,,"1.00,1.00,1.00,1.00,1.00,1.00,1.00,1.00,1.00,1.00,0.00,1.00"
zapatos,zapatos de salon animal print,20,,0.00,0.00,,,,"1.00,1.00,1.00,1.00,1.00,1.00,1.00,1.00,1.00,1.00,1.00,0.00"
zapatos,zapatos de tacon animal print,20,,0.00,0.00,,,,"1.00,1.00,1.00,1.00,1.00,1.00,1.00,1.00,1.00,1.00,1.00,0.00"
zapatos,zapatos estampados animal print,20,,0.00,0.00,,,,"1.00,1.00,1.00,1.00,1.00,1.00,1.00,1.00,1.00,1.00,1.00,0.00"
zapatos,zapatos guess animal print,20,,0.00,1.00,,,,"1.00,1.00,1.00,1.00,1.00,1.00,1.00,1.00,1.00,1.00,1.00,1.00"
zapatos,zapatos lodi animal print,20,,0.00,0.00,,,,"1.00,1.00,1.00,1.00,1.00,1.00,1.00,1.00,1.00,1.00,1.00,0.00"
zapatos,zapatos mujer animal print el corte ingles,20,,0.00,1.00,,,,"1.00,1.00,1.00,1.00,1.00,1.00,1.00,1.00,1.00,1.00,1.00,1.00"
zapatos,zapatos para vestido animal print,20,,0.00,1.00,,,,"1.00,1.00,1.00,1.00,1.00,1.00,1.00,1.00,1.00,1.00,1.00,1.00"
zapatos,zapatos planos mujer animal print,20,,0.00,1.00,,,,"1.00,1.00,1.00,1.00,1.00,1.00,1.00,1.00,1.00,1.00,1.00,1.00"
zapatos,zapatos planos print animal,20,,0.00,0.00,,,,"1.00,1.00,1.00,1.00,1.00,1.00,1.00,1.00,1.00,1.00,1.00,0.00"
zapatos,zapatos print animal,20,,0.13,1.00,,,,"0.00,0.28,0.42,1.00,0.14,0.14,0.28,0.28,0.57,0.28,0.14,0.14"
zapatos,zapatos print animal online,20,,0.00,0.00,,,,"1.00,0.00,0.00,1.00,1.00,1.00,1.00,1.00,1.00,1.00,1.00,1.00"
zapatos,zapatos stilettos animal print,20,,0.00,0.00,,,,"1.00,1.00,1.00,1.00,1.00,1.00,1.00,1.00,1.00,1.00,1.00,0.00"
zapatos,zapatos tacon animal print zara,20,,0.00,0.00,,,,"1.00,1.00,1.00,1.00,1.00,1.00,1.00,1.00,1.00,1.00,1.00,0.00"
zapatos,zapatos tacon print animal,20,,0.00,0.00,,,,"1.00,1.00,1.00,1.00,1.00,1.00,1.00,1.00,1.00,0.00,0.00,0.00"
zapatos,zapatos tacón animal print,20,,0.00,1.00,,,,"1.00,0.66,0.66,0.66,0.66,0.66"
zapatos,zapatos zara animal print,20,,0.00,0.14,,,,"1.00,1.00,1.00,1.00,1.00,1.00,1.00,1.00,1.00,1.00,1.00,1.00"
zapatos,zara zapatos animal print,20,,0.00,1.00,,,,"1.00,1.00,1.00,1.00,1.00,1.00,1.00,1.00,1.00,0.00,0.00,1.00"
zapatos,animal print con zapatos rojos,10,,0.00,0.00,,,,"0.00,0.00,1.00,1.00,0.00,1.00,0.00,1.00,1.00,1.00,0.00,1.00"
zapatos,combinaciones con zapatos animal print,10,,0.00,0.00,,,,"0.00,0.00,1.00,1.00,0.00,1.00,1.00,1.00,0.00,0.00,0.00,1.00"
zapatos,combinar animal print zapatos,10,,0.00,0.00,,,,"0.00,1.00,0.00,1.00,1.00,1.00,1.00,0.00,0.00,1.00,0.00,0.00"
zapatos,combinar outfits zapatos animal print,10,,0.00,0.00,,,,"0.00,0.00,1.00,0.00,0.00,0.00,1.00,1.00,0.00,0.00,0.00,0.00"
zapatos,combinar zapatos animal print,10,,0.00,0.01,,,,"0.00,0.33,0.33,1.00,0.66,0.00,0.00,0.00,0.00,0.00,0.00,0.00"
zapatos,combinar zapatos animal print leopardo,10,,0.00,0.00,,,,"0.00,0.00,1.00,1.00,1.00,1.00,1.00,1.00,1.00,1.00,0.00,0.00"
zapatos,combinar zapatos print animal,10,,0.00,0.00,,,,"0.00,1.00,1.00,1.00,1.00,1.00,1.00,1.00,0.00,1.00,0.00,0.00"
zapatos,como combinar animal print zapatos,10,,0.00,0.00,,,,"0.00,1.00,0.00,1.00,1.00,0.00,1.00,1.00,0.00,0.00,0.00,0.00"
zapatos,como combinar los zapatos animal print,10,,0.00,0.00,,,,"0.00,1.00,0.00,0.00,1.00,1.00,0.00,0.00,0.00,0.00,0.00,1.00"
zapatos,como combinar zapatos de animal print,10,,0.00,0.00,,,,"0.00,0.00,1.00,0.00,1.00,1.00,1.00,1.00,1.00,1.00,1.00,0.00"
zapatos,como usar zapatos animal print,10,,0.00,0.00,,,,"0.00,0.00,0.00,1.00,1.00,1.00,1.00,1.00,0.00,0.00,1.00,0.00"
zapatos,como vestir con zapatos animal print,10,,0.00,0.00,,,,"0.00,0.00,0.00,1.00,0.00,1.00,1.00,0.00,0.00,1.00,0.00,0.00"
zapatos,con que combinar zapatos animal print,10,,0.00,0.00,,,,"1.00,1.00,0.00,1.00,0.00,1.00,1.00,1.00,0.00,0.00,0.00,0.00"
zapatos,con que zapatos combinar un vestido animal print,10,,0.00,0.00,,,,"1.00,1.00,1.00,0.00,0.00,0.00,1.00,0.00,0.00,0.00,0.00,0.00"
zapatos,con que zapatos puedo combinar un vestido animal print,10,,0.00,0.00,,,,"1.00,0.00,1.00,1.00,0.00,1.00,0.00,0.00,1.00,0.00,0.00,0.00"
zapatos,look para zapatos animal print,10,,0.00,0.00,,,,"0.00,0.00,0.00,0.00,0.00,1.00,0.00,1.00,1.00,0.00,0.00,0.00"
zapatos,outfit zapatos animal print serpiente,10,,0.00,0.10,,,,"1.00,1.00,1.00,1.00,0.00,0.00,0.00,1.00,0.00,1.00,0.00,1.00"
zapatos,vestido animal print corto y zapatos,10,,0.00,1.00,,,,"1.00,0.00,1.00,0.00,1.00,0.00,1.00,0.00,1.00,1.00,0.00,1.00"
zapatos,vestido con zapatos animal print,10,,0.00,0.00,,,,"1.00,1.00,1.00,1.00,1.00,0.00,1.00,1.00,0.00,0.00,0.00,0.00"
zapatos,vestido rojo zapatos animal print,10,,0.00,0.00,,,,"0.00,0.00,1.00,1.00,1.00,0.00,0.00,1.00,1.00,1.00,1.00,0.00"
zapatos,vestidos con zapatos animal print,10,,0.00,0.00,,,,"1.00,1.00,1.00,1.00,1.00,0.00,1.00,1.00,0.00,0.00,0.00,0.00"
zapatos,zalando zapatos animal print,10,,0.00,0.00,,,,"1.00,0.00,1.00,0.00,1.00,1.00,0.00,1.00,0.00,0.00,0.00,0.00"
zapatos,zapato animal print mujer,10,,0.00,1.00,,,,"0.00,1.00,0.00,0.00,0.00,0.14,0.28,0.00,0.14,0.00,0.00,0.00"
zapatos,zapatos animal print baratos,10,,0.00,0.00,,,,"0.00,1.00,1.00,1.00,1.00,1.00,1.00,1.00,0.00,0.00,0.00,0.00"
zapatos,zapatos animal print combinar,10,,0.00,0.00,,,,"1.00,0.00,1.00,1.00,0.00,0.00,1.00,1.00,0.00,0.00,0.00,0.00"
zapatos,zapatos animal print con jeans,10,,0.00,0.00,,,,"0.00,0.00,1.00,1.00,0.00,1.00,0.00,0.00,1.00,0.00,1.00,0.00"
zapatos,zapatos animal print corte ingles,10,,0.00,1.00,,,,"0.00,1.00,1.00,1.00,1.00,1.00,1.00,0.00,0.00,0.00,0.00,1.00"
zapatos,zapatos animal print michael kors,10,,0.00,0.00,,,,"0.00,0.00,1.00,1.00,1.00,1.00,1.00,1.00,0.00,0.00,0.00,0.00"
zapatos,zapatos animal print planos,10,,0.00,1.00,,,,"0.00,1.00,1.00,0.00,1.00,1.00,1.00,1.00,1.00,0.00,0.00,1.00"
zapatos,zapatos bajos animal print,10,,0.00,0.00,,,,"0.00,1.00,1.00,1.00,1.00,1.00,0.00,1.00,1.00,1.00,0.00,0.00"
zapatos,zapatos dama animal print,10,,0.00,0.00,,,,"0.50,0.00,0.50,0.50,0.50,0.50,0.50,1.00,1.00,0.00,1.00,0.00"
zapatos,zapatos de animal print,10,,0.00,0.45,,,,"0.00,0.50,0.50,1.00,0.50,0.50,0.50,0.50,1.00,1.00,1.00,1.00"
zapatos,zapatos para combinar vestido animal print,10,,0.00,0.00,,,,"1.00,1.00,1.00,1.00,0.00,0.00,1.00,1.00,1.00,1.00,0.00,0.00"
zapatos,zapatos pedro miralles animal print,10,,0.00,0.00,,,,"0.00,0.00,1.00,1.00,1.00,0.00,0.00,0.00,0.00,0.00,0.00,0.00"
zapatos,zapatos rojos animal print,10,,0.00,0.00,,,,"0.00,1.00,0.00,1.00,0.00,0.00,0.00,1.00,0.00,0.00,0.00,0.00"
zapatos,zapatos steve madden animal print,10,,0.00,0.00,,,,"0.00,0.00,0.00,0.00,0.00,1.00,0.00,1.00,1.00,1.00,1.00,0.00"
zapatos,zapatos tacon alto animal print,10,,0.00,0.00,,,,"1.00,0.00,1.00,1.00,1.00,1.00,1.00,0.00,0.00,0.00,0.00,0.00"
zapatos,zapatos tacon bajo animal print,10,,0.00,1.00,,,,"0.00,1.00,1.00,0.00,1.00,1.00,0.00,1.00,1.00,1.00,0.00,1.00"
zapatos,zapatos tacon medio animal print,10,,0.00,0.00,,,,"0.00,1.00,1.00,1.00,0.00,0.00,1.00,0.00,0.00,0.00,0.00,0.00"
zapatos,zara zapatos mujer animal print,10,,0.00,0.00,,,,"1.00,1.00,1.00,1.00,1.00,1.00,1.00,1.00,0.00,0.00,1.00,0.00"
adidas,adidas animal print,210,21,0.00,1.00,36300000,"Informational, Navigational","Reviews, Image, Image pack, Video, Related searches, Popular products","0.23,1.00,0.36,0.29,0.12,0.29,0.29,0.23,0.15,0.09,0.09,0.09"
adidas,adidas animal print mujer,110,22,0.00,1.00,74,"Informational, Navigational","Reviews, Image, Image pack, Related searches","0.25,0.63,0.63,0.63,0.88,1.00,0.88,1.00,0.88,0.88,0.38,0.25"
adidas,animal print adidas,90,25,0.00,1.00,45000000,"Informational, Transactional","Reviews, Image, Image pack, Video, People also ask, Related searches","0.04,0.14,0.00,0.33,0.52,1.00,1.00,0.52,0.52,0.23,0.52,0.52"
adidas,zapatillas adidas animal print,90,22,0.00,1.00,58,"Informational, Transactional","Reviews, Image, Image pack, Related searches","0.41,1.00,0.64,0.52,0.52,0.64,0.52,0.64,0.52,0.41,0.29,0.11"
adidas,zapatillas adidas animal print mujer,40,21,0.00,1.00,58,"Informational, Transactional","Reviews, Image, Image pack, Related searches","0.13,1.00,1.00,0.13,0.13,0.13,0.13,0.13,0.13,0.13,0.13,0.13"
adidas,adidas animal print amber,30,16,0.00,0.00,57,"Informational, Transactional","Reviews, Image, Image pack, Video carousel, Knowledge panel","0.00,1.00,0.14,0.14,0.14,0.14,0.14,0.14,0.14,0.14,0.00,0.00"
adidas,adidas hu nmd animal print,30,10,0.00,0.33,61,"Informational, Transactional","Reviews, Indented, Image, Image pack, Video carousel, Related searches","0.18,1.00,0.18,0.18,0.18,0.18,0.18,0.18,0.18,0.18,0.18,0.18"
adidas,adidas nmd animal print,30,18,0.00,1.00,81,Informational,"Reviews, Image, Image pack, Video carousel, People also ask, Knowledge panel, Related searches, Related products","0.17,1.00,0.17,0.17,0.17,0.17,0.17,0.17,0.17,0.17,0.17,0.17"
adidas,mochila adidas animal print,30,,0.00,1.00,,,,"0.18,0.18,0.18,0.18,0.18,0.18,0.36,0.27,0.18,1.00,0.18,0.18"
adidas,sudadera adidas animal print,30,,0.00,1.00,,,,"0.18,0.18,0.18,0.18,0.27,1.00,0.18,0.27,0.18,0.18,0.18,0.18"
adidas,zapatilla adidas animal print,30,,0.00,1.00,,,,"0.50,0.00,0.00,0.00,0.00,0.00,0.00,1.00,0.64,0.00,0.35,0.14"
adidas,adidas animal print hombre,20,,0.00,1.00,,,,"1.00,1.00,1.00,1.00,1.00,1.00,1.00,1.00,1.00,1.00,1.00,1.00"
adidas,adidas animal print leggings,20,,0.00,0.00,,,,"1.00,0.00,1.00,1.00,1.00,1.00,1.00,1.00,1.00,0.00,1.00,0.00"
adidas,adidas animal print shoes,20,,0.00,1.00,,,,"1.00,1.00,1.00,1.00,1.00,1.00,1.00,1.00,1.00,1.00,1.00,1.00"
adidas,adidas animal print sneakers,20,,0.00,0.00,,,,"1.00,1.00,1.00,1.00,0.00,1.00,1.00,1.00,1.00,1.00,1.00,0.00"
adidas,adidas brown zx flux animal print,20,,0.00,0.90,,,,"1.00,1.00,1.00,1.00,1.00,1.00,1.00,1.00,1.00,1.00,1.00,1.00"
adidas,adidas choigo animal print,20,,0.00,0.00,,,,"1.00,1.00,1.00,1.00,0.00,1.00,1.00,1.00,1.00,1.00,1.00,0.00"
adidas,adidas falcon animal print,20,,0.00,1.00,,,,"1.00,1.00,1.00,1.00,1.00,1.00,1.00,1.00,1.00,1.00,1.00,1.00"
adidas,adidas gazelle animal print,20,,0.00,0.00,,,,"1.00,1.00,1.00,0.00,1.00,1.00,1.00,1.00,1.00,1.00,1.00,0.00"
adidas,adidas grand court animal print,20,,0.00,1.00,,,,"1.00,1.00,1.00,1.00,1.00,1.00,0.00,1.00,0.00,0.00,1.00,1.00"
adidas,adidas mujer animal print,20,,0.00,1.00,,,,"1.00,1.00,1.00,1.00,1.00,1.00,1.00,1.00,1.00,1.00,1.00,1.00"
adidas,adidas nizza animal print,20,,0.00,0.00,,,,"0.00,0.00,0.22,1.00,0.77,0.22,0.22,0.22,0.22,0.00,0.22,0.00"
adidas,adidas nmd r1 animal print,20,,0.00,1.00,,,,"1.00,1.00,1.00,1.00,1.00,1.00,1.00,1.00,1.00,0.00,0.00,1.00"
adidas,adidas originals animal print,20,,0.00,0.86,,,,"1.00,1.00,1.00,1.00,1.00,1.00,1.00,1.00,1.00,1.00,1.00,1.00"
adidas,adidas pharrell animal print,20,,0.00,1.00,,,,"0.00,1.00,1.00,1.00,1.00,1.00,1.00,1.00,1.00,1.00,1.00,1.00"
adidas,adidas pharrell williams animal print,20,,0.00,0.41,,,,"1.00,1.00,1.00,1.00,1.00,1.00,0.00,1.00,1.00,1.00,1.00,1.00"
adidas,adidas print animal,20,,0.00,1.00,,,,"0.66,1.00,0.66,0.66,0.66,0.66,0.66,0.66,0.66,0.66,0.66,0.66"
adidas,adidas stan smith animal print,20,,0.00,1.00,,,,"1.00,1.00,1.00,1.00,1.00,1.00,1.00,1.00,1.00,1.00,1.00,1.00"
adidas,adidas superstar animal print,20,,0.00,1.00,,,,"1.00,1.00,1.00,1.00,1.00,1.00,1.00,1.00,1.00,1.00,1.00,1.00"
adidas,adidas superstar animal print mujer,20,,0.00,1.00,,,,"1.00,1.00,1.00,1.00,1.00,1.00,1.00,0.00,1.00,1.00,1.00,1.00"
adidas,adidas ultra boost animal print,20,,0.00,1.00,,,,"1.00,1.00,1.00,1.00,1.00,1.00,1.00,1.00,1.00,1.00,1.00,1.00"
adidas,adidas zx flux animal print,20,,0.00,1.00,,,,"1.00,1.00,1.00,1.00,1.00,1.00,1.00,0.00,1.00,1.00,1.00,1.00"
adidas,calcetines adidas animal print,20,,0.00,1.00,,,,"0.00,0.00,0.00,1.00,1.00,1.00,1.00,1.00,1.00,1.00,1.00,1.00"
adidas,camiseta adidas animal print,20,,0.00,1.00,,,,"1.00,1.00,1.00,1.00,1.00,1.00,1.00,1.00,1.00,1.00,1.00,1.00"
adidas,chaqueta adidas animal print,20,,0.00,1.00,,,,"1.00,1.00,1.00,1.00,1.00,1.00,1.00,1.00,1.00,1.00,1.00,1.00"
adidas,conjunto adidas animal print,20,,0.00,1.00,,,,"1.00,0.00,1.00,1.00,0.00,1.00,1.00,1.00,1.00,1.00,1.00,1.00"
adidas,leggings adidas animal print,20,,0.00,0.00,,,,"1.00,1.00,1.00,1.00,1.00,1.00,1.00,1.00,1.00,1.00,1.00,0.00"
adidas,mochila animal print adidas,20,,0.00,1.00,,,,"0.00,1.00,1.00,1.00,1.00,1.00"
adidas,sudadera animal print adidas,20,,0.00,1.00,,,,"1.00,1.00,1.00,1.00,1.00,1.00,1.00,1.00,1.00,1.00,1.00,1.00"
adidas,superstar adidas animal print,20,,0.00,0.00,,,,"1.00,1.00,1.00,1.00,1.00,1.00,1.00,1.00,0.00,1.00,1.00,0.00"
adidas,tenis adidas animal print,20,,0.00,0.86,,,,"0.00,1.00,1.00,1.00,1.00,1.00,1.00,1.00,1.00,1.00,1.00,1.00"
adidas,tenis adidas mujer animal print,20,,0.00,0.89,,,,"0.00,1.00,1.00,1.00,1.00,1.00,0.00,1.00,1.00,1.00,1.00,1.00"
adidas,tenis animal print adidas,20,,0.00,0.00,,,,"0.00,1.00,1.00,1.00,0.50,0.50,0.50,0.50,1.00,1.00,0.50,0.50"
adidas,vestido adidas animal print,20,,0.00,1.00,,,,"1.00,1.00,1.00,1.00,1.00,1.00,0.00,1.00,1.00,1.00,1.00,1.00"
adidas,zapatillas animal print mujer adidas,20,,0.00,1.00,,,,"0.00,0.00,0.00,1.00,1.00,1.00,1.00,1.00,1.00,1.00,1.00,1.00"
adidas,adidas advantage animal print,10,,0.00,0.00,,,,"1.00,1.00,1.00,1.00,0.00,0.00,0.00,0.00,0.00,0.00,0.00,0.00"
adidas,adidas animal print backpack,10,,0.00,0.00,,,,"0.00,0.00,0.00,0.00,0.00,1.00,0.00,0.00,1.00,1.00,1.00,0.00"
adidas,adidas animal print clothing,10,,0.00,0.00,,,,"0.00,0.00,1.00,0.00,0.00,1.00,0.00,0.00,0.00,1.00,0.00,0.00"
adidas,adidas animal print jacket,10,,0.00,1.00,,,,"1.00,0.00,1.00,0.00,1.00,0.00,0.00,0.00,1.00,1.00,1.00,1.00"
adidas,adidas animal print nmd,10,,0.00,1.00,,,,"0.00,1.00,0.00,0.00,0.00,1.00,0.00,1.00,0.00,0.00,1.00,1.00"
adidas,adidas animal print shorts,10,,0.00,1.00,,,,"0.00,0.00,0.00,1.00,0.00,0.00,0.00,0.00,1.00,0.00,1.00,1.00"
adidas,adidas animal print superstar,10,,0.00,1.00,,,,"0.00,1.00,0.00,1.00,0.00,0.00,1.00,1.00,0.00,1.00,0.00,1.00"
adidas,adidas animal print tenis,10,,0.00,0.00,,,,"0.00,1.00,0.00,0.00,1.00,0.00,0.00,0.00,0.00,0.00,1.00,0.00"
adidas,adidas animal print trainers,10,,0.00,0.00,,,,"0.00,1.00,0.00,1.00,0.00,1.00,1.00,0.00,1.00,1.00,0.00,0.00"
adidas,adidas brown zx flux animal print sneakers,10,,0.00,0.43,,,,"0.00,1.00,0.00,0.00,0.00,0.00,1.00,1.00,1.00,1.00,0.00,1.00"
adidas,adidas con animal print,10,,0.00,0.00,,,,"1.00,0.00,1.00,1.00,1.00,1.00,1.00,1.00,0.00,0.00,0.00,0.00"
adidas,adidas continental 80 animal print,10,,0.00,0.00,,,,"0.00,1.00,1.00,0.00,0.00,1.00,0.00,0.00,1.00,1.00,0.00,0.00"
adidas,adidas court bold animal print,10,,0.00,0.00,,,,"1.00,0.00,1.00,0.00,0.00,0.00,1.00,1.00,1.00,0.00,1.00,0.00"
adidas,adidas falcon mujer animal print,10,,0.00,0.00,,,,"0.00,1.00,0.00,0.00,0.00,0.00,1.00,1.00,1.00,0.00,1.00,0.00"
adidas,adidas future icons animal print,10,,0.00,0.00,,,,"0.00,1.00,0.00,1.00,1.00,1.00,0.00,1.00,0.00,0.00,0.00,0.00"
adidas,adidas hu animal print,10,,0.00,0.00,,,,"0.00,1.00,1.00,1.00,1.00,1.00,1.00,1.00,0.00,1.00,0.00,0.00"
adidas,adidas hu nmd animal print amber,10,,0.00,1.00,,,,"0.00,1.00,1.00,1.00,1.00,0.00,0.00,0.00,0.00,0.00,0.00,1.00"
adidas,adidas human race animal print,10,,0.00,0.00,,,,"0.00,1.00,0.00,1.00,1.00,1.00,0.00,1.00,0.00,0.00,1.00,0.00"
adidas,adidas jeremy scott animal print,10,,0.00,0.00,,,,"0.00,0.00,1.00,0.00,1.00,1.00,0.00,1.00,1.00,1.00,0.00,0.00"
adidas,adidas leggings animal print,10,,0.00,1.00,,,,"1.00,0.00,1.00,0.00,1.00,1.00,1.00,0.00,0.00,1.00,0.00,1.00"
adidas,adidas nmd hu animal print,10,,0.00,1.00,,,,"1.00,1.00,1.00,1.00,1.00,0.00,1.00,1.00,0.00,0.00,0.00,1.00"
adidas,adidas nmd hu pharrell animal print altered blue,10,,0.00,0.00,,,,"1.00,1.00,1.00,1.00,0.00,0.00,0.00,0.00,0.00,0.00,0.00,0.00"
adidas,adidas ozweego animal print,10,,0.00,0.00,,,,"0.00,0.00,1.00,0.00,1.00,0.00,0.00,0.00,1.00,0.00,0.00,0.00"
adidas,adidas rivalry low animal print,10,,0.00,0.00,,,,"1.00,1.00,0.00,0.00,0.00,1.00,1.00,1.00,0.00,1.00,1.00,0.00"
adidas,adidas sambarose animal print,10,,0.00,0.87,,,,"0.00,1.00,1.00,1.00,1.00,0.00,0.00,0.00,0.00,0.00,0.00,1.00"
adidas,adidas sneaker animal print,10,,0.00,0.00,,,,"0.00,0.00,0.00,0.00,0.00,0.00,1.00,1.00,1.00,0.00,0.00,0.00"
adidas,adidas sport animal print shark woven track top,10,,0.00,0.00,,,,"0.50,0.50,0.50,0.00,0.00,1.00,0.00,0.00,0.00,0.50,0.00,0.00"
adidas,adidas stella mccartney animal print,10,,0.00,1.00,,,,"0.00,0.00,1.00,0.00,1.00,0.00,1.00,1.00,1.00,1.00,0.00,1.00"
adidas,adidas suela animal print,10,,0.00,1.00,,,,"0.00,0.00,0.00,1.00,0.00,0.00,1.00,1.00,0.00,0.00,0.00,1.00"
adidas,adidas superstar bold animal print,10,,0.00,0.00,,,,"1.00,1.00,0.00,1.00,0.00,0.00,0.00,0.00,0.00,1.00,0.00,0.00"
adidas,adidas swift run animal print,10,,0.00,0.00,,,,"0.00,0.00,1.00,1.00,1.00,0.00,1.00,1.00,1.00,0.00,0.00,0.00"
adidas,adidas torsion animal print,10,,0.00,1.00,,,,"0.00,0.00,1.00,1.00,1.00,1.00,1.00,1.00,0.00,0.00,0.00,1.00"
adidas,adidas x pharrell williams hu nmd animal print,10,,0.00,0.00,,,,"0.00,0.00,0.00,0.50,0.50,0.50,0.00,0.50,1.00,0.00,1.00,0.00"
adidas,adidas zx 2k boost animal print,10,,0.00,0.00,,,,"1.00,1.00,0.00,0.00,1.00,0.00,0.00,1.00,0.00,0.00,0.00,0.00"
adidas,adidas zx animal print,10,,0.00,0.00,,,,"0.00,1.00,0.00,1.00,0.00,1.00,0.00,0.00,0.00,0.00,1.00,0.00"
adidas,adidas zx flux torsion leopard print animal,10,,0.00,0.00,,,,"0.00,1.00,1.00,0.00,0.00,0.00,1.00,0.00,0.00,0.00,0.00,0.00"
adidas,animal print adidas sneakers,10,,0.00,0.00,,,,"1.00,1.00,0.00,0.00,1.00,1.00,0.00,0.00,1.00,0.00,1.00,0.00"
