Group,Keyword,Volume,Keyword Difficulty,CPC (USD),Competitive Density,Number of Results,Intent,SERP Features,Trend
vestido,vestido animal print,720,23,0.37,1.00,25400000,Informational,"Reviews, Image, Image pack, Related searches","0.55,0.76,1.00,0.76,0.55,0.36,0.36,0.36,0.36,0.30,0.45,0.45"
vestido,animal print vestido,480,22,0.29,1.00,30600000,Informational,"Reviews, Image, Image pack, Video carousel, Related searches","1.00,0.82,1.00,0.82,0.55,0.55,0.44,0.36,0.36,0.36,0.44,0.65"
vestido,vestido animal print zara,390,22,0.00,1.00,44,"Informational, Transactional","Reviews, Image, Image pack, Video, Related searches","0.66,1.00,0.81,0.54,0.66,0.44,0.44,0.54,0.36,0.36,0.36,0.44"
vestido,vestidos animal print,390,25,0.29,1.00,20300000,Informational,"Reviews, Image, Image pack, Related searches","0.81,0.81,1.00,1.00,0.66,0.54,0.44,0.54,0.44,0.44,0.54,0.66"
vestido,vestido animal print mango,320,18,0.40,1.00,62,Informational,"Reviews, Image, Image pack, Related searches, Ads bottom","0.44,1.00,0.81,0.66,0.54,0.35,0.28,0.44,0.35,0.28,0.23,0.28"
vestido,como combinar un vestido animal print con zapatos,170,6,0.00,0.05,75,Informational,"Reviews, Indented, Image, Image pack, Video, People also ask","0.53,1.00,0.81,0.81,0.65,0.28,0.28,0.43,0.43,0.53,0.21,0.28"
vestido,vestido animal print largo,140,11,0.42,1.00,11100000,Informational,"Reviews, Image, Image pack, Video, Related searches, Popular products","0.00,0.81,1.00,0.53,0.28,0.43,0.28,0.09,0.15,0.34,0.09,0.81"
vestido,vestido animal print h&m,110,34,0.00,0.99,61,"Informational, Transactional","Reviews, Image, Related searches","0.64,1.00,0.82,0.82,0.64,0.41,0.52,0.52,0.52,0.52,0.41,0.82"
vestido,vestidos animal print h&m,110,34,0.00,0.99,55,"Informational, Transactional","Reviews, Indented, Image, Image pack, Related searches","0.64,1.00,0.82,0.82,0.64,0.41,0.52,0.52,0.52,0.52,0.41,0.82"
vestido,vestido animal print corto,90,16,0.00,1.00,7870000,Informational,"Reviews, Image, Image pack, Video, Related searches","0.78,0.78,1.00,0.78,0.63,0.35,0.28,0.50,0.28,0.50,0.50,0.50"
vestido,vestido animal print rojo,90,0,0.00,1.00,12000000,Informational,"Reviews, Image, Image pack, Video, Related searches","0.29,0.40,0.65,1.00,0.65,0.65,0.52,0.40,0.29,0.29,0.11,0.11"
vestido,vestido animal print stradivarius,90,20,0.00,1.00,37,Informational,"Site links, Image, Image pack, Related searches","1.00,1.00,1.00,1.00,0.82,1.00,0.62,0.82,1.00,0.44,0.62,0.62"
vestido,vestido camisero animal print,90,16,0.00,1.00,969000,Informational,"Reviews, Image, Image pack, Video, Related searches","0.65,1.00,0.83,0.53,0.41,0.29,0.29,0.53,0.53,0.41,0.24,0.24"
vestido,vestidos zara animal print,90,20,0.00,0.95,44,Informational,"Reviews, Image, Image pack, Related searches","0.78,0.64,0.64,0.78,1.00,0.50,0.35,0.78,0.35,0.35,0.50,0.28"
vestido,lola casademunt vestido animal print,70,7,0.09,1.00,54,Informational,"Image, Image pack, Related searches, Shopping ads, Ads bottom","0.78,0.28,0.14,0.21,0.14,0.21,0.28,0.78,0.78,0.28,0.28,1.00"
vestido,vestido largo animal print,70,9,0.42,1.00,14000000,Informational,"Reviews, Image, Image pack, Video, Related searches","1.00,0.00,0.19,0.81,0.53,0.00,0.00,0.43,0.53,0.23,0.43,0.19"
vestido,vestido lencero animal print,70,14,0.00,1.00,210000,Informational,"Reviews, Image, Image pack, Related searches","0.50,0.50,0.13,0.06,0.06,0.06,0.06,0.06,0.06,0.50,0.63,1.00"
vestido,vestido midi animal print,70,17,0.00,1.00,14500000,Informational,"Reviews, Indented, Image, Image pack, Related searches","0.17,1.00,1.00,1.00,0.17,0.17,0.17,1.00,0.17,0.17,0.17,0.17"
vestido,vestido zara animal print,70,25,0.00,0.95,54,Navigational,"Site links, Reviews, Image, Image pack, Video, Related searches","0.76,0.48,0.62,0.76,1.00,0.48,0.34,0.76,0.34,0.34,0.48,0.28"
vestido,mango vestido animal print,50,23,0.45,1.00,53,Informational,"Reviews, Image, Image pack, Related searches, Ads top","1.00,1.00,1.00,1.00,0.27,0.18,0.18,0.18,0.18,0.18,0.18,0.18"
vestido,vestido mango animal print,50,24,0.00,1.00,67,"Informational, Transactional","Reviews, Image, Image pack, Related searches, Ads bottom","1.00,1.00,0.18,1.00,0.18,0.18,0.18,0.18,0.18,0.18,0.18,0.18"
vestido,vestido print animal,50,22,0.21,1.00,25000000,Informational,"Reviews, Image, Image pack, Video, People also ask, Related searches","0.63,0.50,0.63,0.63,1.00,0.00,0.00,0.00,0.00,0.00,0.00,0.00"
vestido,vestidos de animal print cortos,50,19,0.00,0.75,8110000,Commercial,"Reviews, Image, Image pack, Video, Related searches, Popular products","0.14,0.14,0.50,1.00,0.28,0.78,0.14,0.14,0.14,0.64,0.28,0.14"
vestido,vestido animal print verde,40,3,0.00,1.00,20900000,Informational,"Reviews, Image, Image pack, Related searches","0.14,0.14,0.78,0.21,1.00,0.14,0.14,0.14,0.14,0.14,0.14,0.14"
vestido,vestidos animal print el corte ingles,40,25,0.00,0.98,56,Informational,"Image, Image pack, Related searches","0.62,0.44,1.00,0.26,0.44,0.18,0.18,0.18,0.18,0.18,0.18,0.18"
vestido,vestidos animal print zara,40,13,0.00,1.00,42,Informational,"Reviews, Image, Image pack, Related searches","0.55,0.55,1.00,0.77,0.55,0.22,0.22,0.22,0.22,0.44,0.22,0.33"
vestido,como usar vestido animal print,30,,0.00,0.36,,,,"0.00,0.00,0.00,0.00,0.00,0.64,0.14,1.00,0.00,0.14,0.14,0.14"
vestido,vestido animal print mujer,30,19,0.50,1.00,15600000,Informational,"Reviews, Indented, Image, Image pack, Video, Related searches","0.10,0.21,1.00,1.00,0.21,0.21,0.21,0.21,0.21,0.21,0.21,1.00"
vestido,vestido manga larga animal print,30,,0.00,0.00,,,,"0.29,1.00,0.29,0.57,0.57,0.29,0.29,0.57,0.29,0.29,0.29,0.00"
vestido,vestido rojo animal print,30,,0.00,1.00,,,,"0.18,0.18,1.00,0.18,0.18,0.18,0.18,0.18,0.18,0.18,0.18,0.18"
vestido,vestidos animal print el corte inglés,30,,0.00,0.98,,,,"0.00,0.18,1.00,0.45,0.18,0.18,0.18,0.18,0.18,0.18,0.18,0.18"
vestido,vestidos animal print mujer,30,21,0.50,1.00,98,Informational,"Reviews, Image, Image pack, Video, Related searches","0.27,0.27,1.00,1.00,0.27,0.27,0.27,0.27,0.27,0.27,0.27,1.00"
vestido,vestidos de animal print,30,,0.00,1.00,,,,"0.20,0.20,1.00,0.20,0.20,0.20,0.20,0.20,0.20,0.20,0.20,0.20"
vestido,zara vestido animal print,30,,0.00,0.94,,,,"0.18,0.18,0.18,0.27,0.18,1.00,0.18,0.18,0.18,0.18,0.18,0.18"
vestido,accesorios para combinar vestido animal print,20,,0.00,0.00,,,,"1.00,1.00,1.00,1.00,1.00,0.00,1.00,1.00,1.00,1.00,1.00,1.00"
vestido,accesorios para vestido animal print,20,,0.00,1.00,,,,"1.00,1.00,1.00,1.00,1.00,1.00,1.00,1.00,1.00,1.00,1.00,1.00"
vestido,animal print vestido largo,20,,0.00,0.83,,,,"1.00,1.00,1.00,1.00,1.00,1.00,1.00,1.00,1.00,1.00,1.00,1.00"
vestido,asos vestido animal print,20,,0.00,1.00,,,,"1.00,1.00,1.00,1.00,1.00,1.00,1.00,1.00,1.00,1.00,1.00,1.00"
vestido,bershka vestido animal print,20,,0.00,1.00,,,,"1.00,1.00,1.00,1.00,1.00,1.00,1.00,1.00,0.00,1.00,0.00,1.00"
vestido,camisa vestido animal print,20,,0.00,1.00,,,,"0.00,1.00,1.00,1.00,1.00,1.00,1.00,1.00,1.00,1.00,1.00,1.00"
vestido,combinar vestido animal print,20,,0.00,0.86,,,,"1.00,1.00,1.00,1.00,1.00,1.00,1.00,1.00,1.00,1.00,1.00,1.00"
vestido,combinar vestido animal print leopardo,20,,0.00,0.96,,,,"1.00,1.00,1.00,1.00,1.00,1.00,1.00,1.00,1.00,1.00,1.00,1.00"
vestido,como combinar un vestido animal print,20,,0.00,0.00,,,,"1.00,1.00,1.00,1.00,1.00,1.00,1.00,1.00,1.00,1.00,1.00,1.00"
vestido,como combinar un vestido animal print de leopardo,20,,0.00,0.00,,,,"1.00,1.00,1.00,1.00,1.00,1.00,1.00,1.00,1.00,1.00,1.00,0.00"
vestido,como combinar un vestido de animal print,20,,0.00,0.00,,,,"1.00,1.00,1.00,1.00,1.00,1.00,1.00,1.00,1.00,1.00,0.00,0.00"
vestido,como combinar vestido animal print,20,,0.00,1.00,,,,"1.00,1.00,1.00,1.00,1.00,1.00,1.00,1.00,1.00,1.00,1.00,1.00"
vestido,como combinar vestido largo animal print,20,,0.00,0.00,,,,"1.00,1.00,1.00,1.00,1.00,1.00,1.00,1.00,0.00,1.00,1.00,0.00"
vestido,como combinar zapatos animal print con vestido,20,,0.00,0.00,,,,"1.00,1.00,1.00,1.00,1.00,1.00,1.00,1.00,1.00,1.00,0.00,0.00"
vestido,como usar un vestido animal print,20,,0.00,0.00,,,,"1.00,1.00,1.00,1.00,1.00,0.00,1.00,1.00,1.00,0.00,1.00,1.00"
vestido,h&m vestido animal print,20,,0.00,1.00,,,,"1.00,1.00,1.00,1.00,1.00,1.00,1.00,1.00,1.00,1.00,1.00,1.00"
vestido,look con vestido animal print,20,,0.00,1.00,,,,"0.00,1.00,1.00,1.00,1.00,1.00,1.00,1.00,1.00,1.00,1.00,1.00"
vestido,look vestido animal print,20,,0.00,1.00,,,,"1.00,1.00,1.00,1.00,1.00,1.00,1.00,1.00,1.00,1.00,1.00,1.00"
vestido,looks con vestidos animal print,20,,0.00,1.00,,,,"1.00,1.00,1.00,1.00,1.00,1.00,1.00,1.00,1.00,1.00,1.00,1.00"
vestido,looks vestido animal print,20,,0.00,1.00,,,,"1.00,1.00,1.00,1.00,1.00,1.00,1.00,1.00,1.00,1.00,1.00,1.00"
vestido,maquillaje para un vestido animal print,20,,0.00,0.00,,,,"1.00,0.14,0.14,0.00,0.14,0.00,0.00,0.14,0.14,0.00,0.00,0.14"
vestido,maquillaje para vestido animal print,20,,0.00,0.00,,,,"1.00,1.00,1.00,1.00,1.00,1.00,1.00,1.00,1.00,1.00,1.00,1.00"
vestido,mini vestido animal print,20,,0.00,1.00,,,,"1.00,1.00,1.00,1.00,1.00,1.00,1.00,1.00,1.00,1.00,1.00,1.00"
vestido,outfit animal print vestido,20,,0.00,0.00,,,,"1.00,1.00,1.00,1.00,1.00,1.00,1.00,1.00,1.00,1.00,1.00,0.00"
vestido,outfit con vestido animal print,20,,0.00,1.00,,,,"1.00,1.00,1.00,1.00,1.00,1.00,1.00,1.00,1.00,1.00,1.00,1.00"
vestido,outfit vestido animal print,20,,0.00,1.00,,,,"1.00,1.00,1.00,1.00,1.00,1.00,1.00,1.00,1.00,1.00,1.00,1.00"
vestido,outfit vestido animal print corto,20,,0.00,1.00,,,,"1.00,1.00,1.00,1.00,1.00,1.00,1.00,1.00,1.00,1.00,1.00,1.00"
vestido,outfit vestido animal print largo,20,,0.00,0.79,,,,"1.00,1.00,1.00,1.00,1.00,1.00,1.00,1.00,1.00,1.00,1.00,1.00"
vestido,outfit vestido camisero animal print,20,,0.00,1.00,,,,"1.00,1.00,1.00,0.00,1.00,1.00,0.00,1.00,1.00,0.00,1.00,1.00"
vestido,que zapatos usar con vestido animal print,20,,0.00,0.86,,,,"1.00,1.00,1.00,1.00,1.00,1.00,1.00,1.00,1.00,0.00,1.00,1.00"
vestido,shein vestidos animal print,20,,0.92,1.00,,,,"1.00,1.00,1.00,1.00,1.00,1.00,1.00,1.00,1.00,1.00,1.00,1.00"
vestido,stradivarius vestido animal print,20,,0.00,1.00,,,,"1.00,1.00,1.00,1.00,1.00,1.00,1.00,0.00,1.00,1.00,1.00,1.00"
vestido,stradivarius vestidos animal print,20,,0.00,1.00,,,,"1.00,1.00,1.00,1.00,1.00,1.00,1.00,0.00,1.00,1.00,1.00,1.00"
vestido,vestido adidas animal print,20,,0.00,1.00,,,,"1.00,1.00,1.00,1.00,1.00,1.00,0.00,1.00,1.00,1.00,1.00,1.00"
vestido,vestido ajustado animal print,20,,0.00,1.00,,,,"1.00,1.00,1.00,1.00,1.00,1.00,1.00,1.00,1.00,1.00,1.00,1.00"
vestido,vestido animal print amarillo,20,,0.00,1.00,,,,"1.00,1.00,1.00,1.00,1.00,1.00,1.00,1.00,1.00,1.00,1.00,1.00"
vestido,vestido animal print asos,20,,0.00,1.00,,,,"1.00,1.00,1.00,1.00,1.00,0.00,0.00,1.00,0.00,1.00,1.00,1.00"
vestido,vestido animal print azul,20,,0.00,1.00,,,,"0.67,0.67,1.00,0.67,0.67,0.67,0.67,0.67,0.67,0.67,0.67,0.67"
vestido,vestido animal print azul zara,20,,0.00,0.36,,,,"1.00,1.00,1.00,1.00,1.00,1.00,1.00,1.00,1.00,1.00,1.00,1.00"
vestido,vestido animal print bebe,20,,0.00,0.00,,,,"0.00,1.00,1.00,1.00,1.00,1.00,1.00,1.00,1.00,1.00,1.00,0.00"
vestido,vestido animal print bershka,20,,0.00,0.97,,,,"1.00,1.00,1.00,1.00,1.00,1.00,1.00,1.00,1.00,1.00,1.00,1.00"
vestido,vestido animal print c&a,20,,0.00,0.00,,,,"1.00,1.00,1.00,1.00,1.00,1.00,1.00,1.00,1.00,1.00,1.00,0.00"
vestido,vestido animal print cebra,20,,0.00,1.00,,,,"1.00,1.00,1.00,1.00,1.00,1.00,1.00,1.00,1.00,1.00,1.00,1.00"
vestido,vestido animal print cheetah,20,,0.00,1.00,,,,"1.00,1.00,1.00,1.00,1.00,1.00,1.00,1.00,1.00,1.00,1.00,1.00"
vestido,vestido animal print combinar,20,,0.00,1.00,,,,"0.00,1.00,1.00,1.00,1.00,1.00,1.00,1.00,1.00,0.00,0.00,1.00"
vestido,vestido animal print con botas,20,,0.00,1.00,,,,"1.00,1.00,1.00,1.00,1.00,1.00,1.00,1.00,1.00,1.00,1.00,1.00"
vestido,vestido animal print con medias negras,20,,0.00,1.00,,,,"1.00,1.00,1.00,1.00,1.00,1.00,1.00,0.00,1.00,1.00,0.00,1.00"
vestido,vestido animal print con que zapatos,20,,0.00,0.91,,,,"1.00,1.00,1.00,1.00,1.00,1.00,0.00,1.00,0.00,1.00,0.00,1.00"
vestido,vestido animal print con zapatillas,20,,0.00,0.00,,,,"1.00,1.00,1.00,1.00,1.00,1.00,1.00,1.00,1.00,1.00,1.00,0.00"
vestido,vestido animal print con zapatos rojos,20,,0.00,0.00,,,,"1.00,1.00,1.00,1.00,1.00,0.00,1.00,1.00,1.00,1.00,1.00,0.00"
vestido,vestido animal print cortefiel,20,,0.00,1.00,,,,"1.00,1.00,1.00,1.00,1.00,1.00,1.00,1.00,1.00,1.00,1.00,1.00"
vestido,vestido animal print de zara,20,,0.00,1.00,,,,"1.00,1.00,1.00,1.00,1.00,1.00,1.00,1.00,1.00,1.00,1.00,1.00"
vestido,vestido animal print gris,20,,0.00,0.38,,,,"0.00,1.00,1.00,1.00,1.00,1.00,1.00,1.00,1.00,1.00,1.00,1.00"
vestido,vestido animal print guess,20,,0.96,1.00,,,,"1.00,1.00,1.00,1.00,1.00,1.00,1.00,1.00,1.00,1.00,1.00,1.00"
vestido,vestido animal print invierno,20,,0.00,1.00,,,,"1.00,1.00,0.00,1.00,1.00,1.00,1.00,0.00,1.00,1.00,0.00,1.00"
vestido,vestido animal print largo zara,20,,0.00,1.00,,,,"1.00,1.00,1.00,1.00,1.00,1.00,1.00,1.00,1.00,1.00,0.00,1.00"
vestido,vestido animal print lefties,20,,0.00,1.00,,,,"1.00,1.00,1.00,1.00,1.00,1.00,1.00,1.00,1.00,1.00,1.00,1.00"
vestido,vestido animal print leopardo,20,,0.00,1.00,,,,"1.00,1.00,1.00,1.00,1.00,1.00,1.00,1.00,1.00,1.00,1.00,1.00"
vestido,vestido animal print manga larga,20,,0.00,1.00,,,,"1.00,1.00,1.00,1.00,1.00,1.00,1.00,1.00,1.00,1.00,1.00,1.00"
vestido,vestido animal print massimo dutti,20,,0.00,1.00,,,,"1.00,1.00,1.00,1.00,1.00,1.00,1.00,1.00,1.00,1.00,1.00,1.00"
vestido,vestido animal print michael kors,20,,0.00,0.00,,,,"1.00,1.00,1.00,1.00,1.00,1.00,1.00,1.00,0.00,1.00,1.00,0.00"
vestido,vestido animal print midi,20,,0.00,0.92,,,,"1.00,1.00,1.00,1.00,1.00,1.00,1.00,1.00,1.00,1.00,1.00,1.00"
vestido,vestido animal print outfit,20,,0.00,1.00,,,,"1.00,1.00,1.00,1.00,1.00,1.00,1.00,1.00,1.00,1.00,1.00,1.00"
vestido,vestido animal print para boda,20,,0.00,1.00,,,,"1.00,1.00,1.00,1.00,1.00,1.00,1.00,1.00,1.00,1.00,1.00,1.00"
vestido,vestido animal print pull and bear,20,,0.00,1.00,,,,"1.00,1.00,1.00,1.00,1.00,1.00,1.00,1.00,1.00,1.00,1.00,1.00"
vestido,vestido animal print rojo mango,20,,0.00,1.00,,,,"0.00,0.00,1.00,1.00,1.00,1.00,1.00,1.00,1.00,1.00,1.00,1.00"
vestido,vestido animal print rojo zara,20,,0.00,1.00,,,,"1.00,1.00,1.00,1.00,1.00,1.00,1.00,1.00,1.00,1.00,1.00,1.00"
vestido,vestido animal print rosa,20,,0.00,1.00,,,,"1.00,1.00,1.00,1.00,1.00,1.00,1.00,1.00,1.00,1.00,1.00,1.00"
vestido,vestido animal print rosa zara,20,,0.00,1.00,,,,"1.00,1.00,1.00,1.00,1.00,1.00,1.00,1.00,1.00,1.00,1.00,1.00"
vestido,vestido animal print serpiente,20,,0.00,0.00,,,,"1.00,1.00,1.00,1.00,1.00,1.00,1.00,1.00,1.00,1.00,1.00,0.00"
vestido,vestido animal print sfera,20,,0.00,1.00,,,,"1.00,1.00,1.00,1.00,1.00,1.00,1.00,1.00,1.00,1.00,1.00,1.00"
vestido,vestido animal print tirantes,20,,0.00,1.00,,,,"1.00,1.00,1.00,1.00,1.00,1.00,1.00,1.00,1.00,1.00,1.00,1.00"
vestido,vestido animal print zara 2019,20,,0.00,0.00,,,,"1.00,1.00,1.00,1.00,1.00,1.00,1.00,1.00,1.00,0.00,1.00,0.00"
vestido,vestido animal print zara 2020,20,,0.00,1.00,,,,"1.00,0.33,0.67,0.67,0.67,0.67,0.67,0.67,0.67,0.67,0.67,0.67"
vestido,vestido animal print zara corto,20,,0.00,1.00,,,,"1.00,1.00,1.00,1.00,1.00,1.00,1.00,1.00,1.00,1.00,1.00,1.00"
vestido,vestido animal print zara rojo,20,,0.00,0.71,,,,"1.00,1.00,1.00,1.00,1.00,1.00,1.00,1.00,1.00,1.00,0.00,1.00"
vestido,vestido azul animal print,20,,0.00,1.00,,,,"1.00,1.00,1.00,1.00,1.00,1.00,1.00,1.00,1.00,1.00,1.00,1.00"
vestido,vestido azul animal print zara,20,,0.00,0.00,,,,"1.00,1.00,1.00,1.00,1.00,1.00,1.00,1.00,1.00,1.00,1.00,0.00"
vestido,vestido bershka animal print,20,,0.00,1.00,,,,"1.00,1.00,1.00,1.00,1.00,1.00,1.00,1.00,1.00,1.00,1.00,1.00"
vestido,vestido calvin klein animal print,20,,0.00,1.00,,,,"0.00,1.00,1.00,1.00,1.00,1.00,1.00,1.00,1.00,1.00,0.00,1.00"
vestido,vestido camisa animal print,20,,0.00,1.00,,,,"0.00,1.00,0.00,1.00,1.00,1.00,1.00,1.00,1.00,1.00,1.00,1.00"
vestido,vestido camisero animal print mango,20,,0.00,1.00,,,,"1.00,1.00,1.00,1.00,1.00,1.00,1.00,1.00,1.00,1.00,1.00,1.00"
vestido,vestido camisero animal print stradivarius,20,,0.00,0.10,,,,"1.00,1.00,1.00,1.00,1.00,1.00,1.00,0.00,1.00,1.00,1.00,1.00"
vestido,vestido camisero animal print zara,20,,0.00,0.92,,,,"1.00,1.00,1.00,1.00,1.00,1.00,1.00,1.00,1.00,1.00,1.00,1.00"
vestido,vestido camisero largo animal print,20,,0.00,1.00,,,,"1.00,1.00,1.00,1.00,1.00,1.00,1.00,1.00,1.00,1.00,1.00,1.00"
vestido,vestido camisero print animal,20,,0.00,1.00,,,,"1.00,1.00,1.00,1.00,1.00,1.00,1.00,1.00,0.00,0.00,1.00,1.00"
vestido,vestido camisero zara animal print,20,,0.00,0.83,,,,"1.00,1.00,1.00,1.00,1.00,1.00,1.00,1.00,1.00,1.00,1.00,1.00"
vestido,vestido corto animal print zara,20,,0.00,1.00,,,,"1.00,1.00,1.00,1.00,1.00,1.00,1.00,1.00,1.00,1.00,1.00,1.00"
vestido,vestido cruzado animal print,20,,0.00,1.00,,,,"1.00,1.00,1.00,1.00,1.00,1.00,1.00,1.00,1.00,1.00,1.00,1.00"
vestido,vestido de animal print largo,20,,0.00,1.00,,,,"1.00,1.00,1.00,1.00,1.00,1.00,0.00,1.00,1.00,1.00,1.00,1.00"
vestido,vestido de fiesta animal print,20,,0.00,1.00,,,,"1.00,1.00,1.00,1.00,1.00,1.00,1.00,1.00,1.00,1.00,1.00,1.00"
vestido,vestido de gasa animal print,20,,0.00,1.00,,,,"0.00,0.00,0.00,1.00,1.00,1.00,1.00,1.00,1.00,1.00,1.00,1.00"
vestido,vestido denny rose animal print,20,,0.00,1.00,,,,"1.00,1.00,1.00,1.00,1.00,1.00,1.00,1.00,1.00,1.00,1.00,1.00"
vestido,vestido estampado animal print,20,,0.00,1.00,,,,"1.00,1.00,1.00,1.00,1.00,1.00,1.00,1.00,1.00,1.00,1.00,1.00"
vestido,vestido fiesta animal print,20,,0.00,1.00,,,,"1.00,1.00,1.00,1.00,1.00,1.00,1.00,1.00,1.00,1.00,1.00,1.00"
vestido,vestido guess animal print,20,,1.27,1.00,,,,"1.00,1.00,1.00,1.00,1.00,1.00,1.00,1.00,1.00,1.00,1.00,1.00"
vestido,vestido h&m animal print,20,,0.00,0.80,,,,"1.00,1.00,1.00,1.00,1.00,1.00,1.00,1.00,1.00,1.00,1.00,1.00"
vestido,vestido largo animal print mango,20,,0.00,1.00,,,,"1.00,1.00,1.00,1.00,1.00,1.00,1.00,1.00,1.00,1.00,1.00,1.00"
vestido,vestido largo animal print rojo,20,,0.00,1.00,,,,"0.00,1.00,1.00,1.00,1.00,1.00,1.00,1.00,1.00,1.00,1.00,1.00"
vestido,vestido largo animal print zara,20,,0.00,1.00,,,,"1.00,1.00,1.00,1.00,1.00,1.00,1.00,1.00,1.00,1.00,1.00,1.00"
vestido,vestido largo de animal print,20,,0.00,1.00,,,,"1.00,1.00,1.00,1.00,1.00,1.00,1.00,1.00,1.00,1.00,1.00,1.00"
vestido,vestido lefties animal print,20,,0.00,1.00,,,,"1.00,1.00,1.00,1.00,1.00,1.00,1.00,1.00,1.00,1.00,1.00,1.00"
vestido,vestido lencero animal print zara,20,,0.00,1.00,,,,"1.00,1.00,1.00,1.00,1.00,1.00,1.00,1.00,1.00,1.00,1.00,1.00"
vestido,vestido michael kors animal print,20,,0.00,1.00,,,,"1.00,1.00,1.00,1.00,1.00,1.00,1.00,1.00,1.00,1.00,1.00,1.00"
vestido,vestido midi animal print zara,20,,0.00,1.00,,,,"1.00,1.00,1.00,1.00,1.00,1.00,1.00,1.00,1.00,1.00,1.00,1.00"
vestido,vestido mujer animal print,20,,0.00,1.00,,,,"1.00,1.00,1.00,1.00,1.00,1.00,1.00,1.00,1.00,1.00,1.00,1.00"
vestido,vestido print animal rojo,20,,0.00,1.00,,,,"1.00,1.00,1.00,1.00,1.00,1.00,1.00,1.00,1.00,1.00,1.00,1.00"
vestido,vestido print animal zara,20,,0.00,0.95,,,,"1.00,1.00,1.00,1.00,1.00,1.00,1.00,1.00,1.00,1.00,1.00,1.00"
vestido,vestido rojo animal print zara,20,,0.00,0.00,,,,"1.00,1.00,1.00,1.00,1.00,1.00,1.00,1.00,1.00,0.00,0.00,0.00"
vestido,vestido rojo con zapatos animal print,20,,0.00,1.00,,,,"1.00,1.00,1.00,1.00,1.00,0.00,1.00,1.00,1.00,1.00,0.00,1.00"
vestido,vestido rosa animal print,20,,0.00,1.00,,,,"1.00,1.00,1.00,1.00,1.00,1.00,1.00,1.00,1.00,1.00,1.00,1.00"
vestido,vestido scalpers animal print,20,,0.00,0.98,,,,"1.00,0.50,0.50,0.50,0.50,0.50,0.50,0.50,0.50,0.75,0.50,0.50"
vestido,vestido sfera animal print,20,,0.00,1.00,,,,"1.00,1.00,1.00,1.00,1.00,1.00,1.00,1.00,1.00,1.00,1.00,1.00"
vestido,vestido stradivarius animal print,20,,0.00,1.00,,,,"1.00,1.00,1.00,1.00,1.00,1.00,1.00,1.00,1.00,1.00,1.00,1.00"
vestido,vestido tirantes animal print,20,,0.00,1.00,,,,"1.00,1.00,1.00,1.00,1.00,0.00,1.00,1.00,1.00,1.00,1.00,1.00"
vestido,vestido vans animal print,20,,0.00,1.00,,,,"1.00,1.00,1.00,1.00,1.00,1.00,1.00,1.00,1.00,1.00,0.00,1.00"
vestido,vestido verde animal print,20,,0.00,1.00,,,,"1.00,1.00,1.00,1.00,1.00,1.00,1.00,1.00,1.00,1.00,1.00,1.00"
vestido,vestido zara animal print azul,20,,0.00,0.77,,,,"1.00,1.00,1.00,1.00,1.00,1.00,1.00,1.00,1.00,1.00,1.00,1.00"
vestido,vestido zara animal print rojo,20,,0.00,1.00,,,,"1.00,1.00,1.00,1.00,1.00,1.00,1.00,1.00,1.00,1.00,1.00,1.00"
vestido,vestidos animal print 2020,20,,0.00,1.00,,,,"0.00,1.00,1.00,0.00,0.00,1.00,1.00,1.00,1.00,1.00,1.00,1.00"
vestido,vestidos animal print 2022,20,,0.00,0.00,,,,"1.00,1.00,1.00,1.00,1.00,1.00,0.00,1.00,1.00,1.00,0.00,0.00"
vestido,vestidos animal print 2023,20,,0.00,1.00,,,,"0.00,0.00,0.00,0.00,0.00,0.00,1.00,0.14,0.14,0.14,0.14,0.14"
vestido,vestidos animal print amazon,20,,0.00,1.00,,,,"1.00,1.00,1.00,1.00,1.00,1.00,1.00,1.00,0.00,1.00,1.00,1.00"
vestido,vestidos animal print colores,20,,0.00,1.00,,,,"1.00,1.00,1.00,1.00,1.00,1.00,1.00,1.00,1.00,1.00,1.00,1.00"
vestido,vestidos animal print manga larga,20,,0.00,1.00,,,,"1.00,1.00,1.00,1.00,1.00,1.00,1.00,1.00,1.00,1.00,1.00,1.00"
vestido,vestidos animal print mango,20,,0.40,1.00,,,,"0.00,0.28,1.00,1.00,0.42,0.57,0.00,0.00,0.00,0.00,0.00,0.28"
vestido,vestidos camiseros animal print,20,,0.00,1.00,,,,"1.00,1.00,1.00,1.00,1.00,1.00,1.00,1.00,1.00,1.00,1.00,1.00"
vestido,vestidos de animal print elegantes,20,,0.00,0.00,,,,"1.00,0.00,1.00,0.00,1.00,1.00,1.00,1.00,1.00,1.00,1.00,0.00"
vestido,vestidos de animal print largos,20,,0.00,1.00,,,,"0.25,1.00,0.50,0.50,0.50,0.50,0.00,0.50,0.50,0.50,0.50,0.50"
vestido,vestidos de baño animal print,20,,0.00,1.00,,,,"1.00,0.00,0.00,1.00,0.00,1.00,1.00,1.00,1.00,1.00,1.00,1.00"
vestido,vestidos de fiesta animal print,20,,0.00,1.00,,,,"1.00,1.00,1.00,1.00,1.00,1.00,1.00,1.00,1.00,1.00,1.00,1.00"
vestido,vestidos estampado animal print,20,,0.00,1.00,,,,"1.00,1.00,1.00,1.00,1.00,1.00,1.00,1.00,1.00,1.00,1.00,1.00"
vestido,vestidos estampados animal print,20,,0.00,1.00,,,,"1.00,1.00,1.00,1.00,1.00,1.00,1.00,1.00,1.00,1.00,1.00,1.00"
vestido,vestidos mujer animal print,20,,0.00,1.00,,,,"1.00,1.00,1.00,1.00,1.00,1.00,1.00,1.00,1.00,1.00,1.00,1.00"
vestido,zapatos para vestido animal print,20,,0.00,1.00,,,,"1.00,1.00,1.00,1.00,1.00,1.00,1.00,1.00,1.00,1.00,1.00,1.00"
vestido,zara vestido print animal,20,,0.00,0.50,,,,"1.00,1.00,1.00,1.00,1.00,1.00,1.00,1.00,1.00,1.00,1.00,1.00"
vestido,accesorios para un vestido animal print,10,,0.00,0.00,,,,"1.00,0.00,0.00,1.00,1.00,0.00,1.00,1.00,1.00,1.00,1.00,0.00"
vestido,animal print vest,10,,0.00,0.00,,,,"1.00,0.00,1.00,1.00,1.00,0.00,0.00,0.00,0.00,0.00,1.00,1.00"
vestido,animal print vestidos,10,,0.29,1.00,,,,"0.00,1.00,0.00,1.00,0.75,0.25,0.00,0.00,0.00,0.00,0.00,0.00"
vestido,color de uñas para vestido animal print,10,,0.00,0.00,,,,"1.00,1.00,1.00,0.00,0.00,0.00,1.00,1.00,1.00,1.00,1.00,0.00"
vestido,combinar vestido animal print largo,10,,0.00,0.00,,,,"0.00,0.00,1.00,0.00,1.00,1.00,1.00,1.00,0.00,0.00,0.00,0.00"
vestido,combinar vestido animal print serpiente,10,,0.00,0.00,,,,"0.00,0.00,0.00,0.00,1.00,0.00,1.00,0.00,1.00,0.00,1.00,0.00"
vestido,como combinar vestido de animal print,10,,0.00,0.00,,,,"1.00,1.00,0.00,1.00,0.00,0.00,0.00,1.00,1.00,0.00,1.00,0.00"
vestido,como llevar un vestido de animal print,10,,0.00,0.00,,,,"1.00,0.00,1.00,0.00,0.00,1.00,0.00,1.00,1.00,0.00,0.00,0.00"
vestido,como puedo combinar un vestido de animal print,10,,0.00,0.00,,,,"0.00,1.00,1.00,1.00,1.00,0.00,0.00,1.00,1.00,1.00,0.00,0.00"
vestido,como vestir animal print,10,,0.00,0.00,,,,"1.00,1.00,1.00,1.00,0.00,1.00,0.00,0.00,1.00,1.00,0.00,0.00"
vestido,como vestir con animal print,10,,0.00,1.00,,,,"0.00,0.00,0.00,0.00,1.00,1.00,1.00,0.00,1.00,0.00,0.00,1.00"
vestido,como vestir con zapatos animal print,10,,0.00,0.00,,,,"0.00,0.00,0.00,1.00,0.00,1.00,1.00,0.00,0.00,1.00,0.00,0.00"
vestido,complementos para vestido animal print,10,,0.00,0.00,,,,"1.00,1.00,1.00,1.00,1.00,0.00,0.00,1.00,0.00,1.00,1.00,0.00"
vestido,comprar vestido animal print,10,,0.00,0.00,,,,"1.00,1.00,1.00,1.00,1.00,0.00,0.00,0.00,1.00,1.00,1.00,0.00"
vestido,con que zapatos combinar un vestido animal print,10,,0.00,0.00,,,,"1.00,1.00,1.00,0.00,0.00,0.00,1.00,0.00,0.00,0.00,0.00,0.00"
vestido,con que zapatos puedo combinar un vestido animal print,10,,0.00,0.00,,,,"1.00,0.00,1.00,1.00,0.00,1.00,0.00,0.00,1.00,0.00,0.00,0.00"
vestido,maquillaje con vestido animal print,10,,0.00,0.00,,,,"0.00,1.00,0.00,0.22,0.22,0.00,0.00,0.00,0.22,0.00,0.00,0.22"
vestido,maquillaje de ojos para vestido animal print,10,,0.00,0.00,,,,"0.00,0.00,1.00,0.00,1.00,1.00,0.00,0.00,0.00,0.00,0.00,0.00"
vestido,maquillaje para vestido de animal print,10,,0.00,0.00,,,,"1.00,0.00,0.00,1.00,1.00,1.00,1.00,0.00,0.00,0.00,0.00,0.00"
vestido,uñas para vestido animal print,10,,0.00,0.00,,,,"0.00,0.00,0.00,1.00,0.00,1.00,1.00,0.00,1.00,0.00,0.00"
vestido,vestido animal print 2019,10,,0.00,1.00,,,,"0.00,0.00,0.00,0.00,0.00,0.00,1.00,0.00,0.00,0.00,1.00,1.00"
vestido,vestido animal print 2022,10,,0.00,0.00,,,,"1.00,1.00,1.00,1.00,1.00,0.00,1.00,1.00,1.00,0.00,0.00,0.00"
vestido,vestido animal print blanco y negro,10,,0.00,0.00,,,,"1.00,0.00,1.00,1.00,0.00,0.00,0.00,0.00,0.00,0.00,0.00,0.00"
vestido,vestido animal print casual,10,,0.00,1.00,,,,"0.00,0.00,0.00,0.00,0.00,0.00,1.00,1.00,1.00,1.00,1.00,1.00"
vestido,vestido animal print cheetah corto,10,,0.00,0.00,,,,"1.00,1.00,0.00,0.00,1.00,1.00,1.00,1.00,0.00,0.00,0.00,1.00"
vestido,vestido animal print colorido,10,,0.00,0.00,,,,"1.00,1.00,1.00,1.00,0.00,0.00,0.00,1.00,1.00,1.00,1.00,0.00"
vestido,vestido animal print con medias,10,,0.00,1.00,,,,"0.00,0.00,0.00,0.00,1.00,1.00,1.00,0.00,1.00,1.00,0.00,1.00"
vestido,vestido animal print corte ingles,10,,0.00,1.00,,,,"1.00,1.00,1.00,1.00,1.00,1.00,1.00,0.00,0.00,0.00,0.00,1.00"
vestido,vestido animal print corto y zapatos,10,,0.00,1.00,,,,"1.00,0.00,1.00,0.00,1.00,0.00,1.00,0.00,1.00,1.00,0.00,1.00"
vestido,vestido animal print dolores promesas,10,,0.00,1.00,,,,"1.00,1.00,1.00,1.00,0.00,1.00,0.00,0.00,1.00,0.00,0.00,1.00"
