Group,Keyword,Volume,Keyword Difficulty,CPC (USD),Competitive Density,Number of Results,Intent,SERP Features,Trend
serpiente,zapatillas animal print serpiente,10,,0.00,0.00,,,,"0.00,1.00,1.00,0.00,0.00,0.00,0.00,1.00,1.00,0.00,0.00,0.00"
estampado,estampado animal print,140,21,0.00,0.99,13400000,Informational,"Reviews, Image, Image pack, People also ask, Related searches","0.65,1.00,1.00,1.00,0.82,0.82,1.00,0.82,0.65,0.65,0.52,0.52"
estampado,estampados animal print,40,27,0.00,1.00,5400000,Informational,"Image, Image pack, Video carousel, People also ask, Related searches","0.80,1.00,1.00,1.00,0.59,1.00,0.80,0.80,0.80,0.59,0.80,0.80"
estampado,animal print estampado,20,,0.00,1.00,,,,"1.00,1.00,1.00,1.00,1.00,1.00,1.00,1.00,1.00,1.00,1.00,1.00"
estampado,blusas estampado animal print,20,,0.00,1.00,,,,"1.00,1.00,1.00,1.00,1.00,1.00,1.00,1.00,1.00,1.00,1.00,1.00"
estampado,camiseta estampado animal print,20,,0.00,1.00,,,,"1.00,1.00,1.00,1.00,1.00,1.00,1.00,1.00,1.00,1.00,1.00,1.00"
estampado,como combinar estampado animal print,20,,0.00,0.00,,,,"0.00,1.00,1.00,1.00,0.00,1.00,1.00,1.00,1.00,1.00,0.00,1.00"
estampado,estampado animal print 2022,20,,0.00,0.00,,,,"0.66,1.00,0.66,0.66,0.66,0.66,0.66,0.66,0.66,0.00,0.66,0.00"
estampado,estampado animal print rosa,20,,0.00,1.00,,,,"1.00,1.00,1.00,0.00,1.00,0.00,1.00,1.00,1.00,1.00,1.00,1.00"
estampado,estampado animal print verde,20,,0.00,1.00,,,,"1.00,1.00,1.00,1.00,1.00,0.00,1.00,0.00,1.00,1.00,1.00,1.00"
estampado,estampado de animal print,20,,0.00,1.00,,,,"1.00,1.00,1.00,1.00,1.00,1.00,1.00,1.00,1.00,1.00,1.00,1.00"
estampado,estampado print animal,20,,0.00,1.00,,,,"1.00,1.00,1.00,1.00,1.00,1.00,1.00,1.00,1.00,1.00,1.00,1.00"
estampado,estampados de animal print,20,,0.00,1.00,,,,"1.00,1.00,1.00,1.00,1.00,1.00,1.00,1.00,1.00,1.00,1.00,1.00"
estampado,falda estampado animal print,20,,0.00,1.00,,,,"1.00,1.00,1.00,1.00,1.00,1.00,1.00,1.00,1.00,1.00,1.00,1.00"
estampado,leggins estampados animal print,20,,0.00,0.00,,,,"0.00,0.00,1.00,1.00,1.00,1.00,1.00,1.00,1.00,0.00,1.00,1.00"
estampado,polar estampado animal print,20,,0.00,1.00,,,,"0.00,0.00,1.00,1.00,1.00,1.00,1.00,1.00,1.00,1.00,1.00,1.00"
estampado,tela estampada animal print,20,,0.00,1.00,,,,"1.00,1.00,1.00,1.00,1.00,1.00,1.00,1.00,1.00,1.00,1.00,1.00"
estampado,tela estampado animal print,20,,0.00,1.00,,,,"1.00,1.00,1.00,1.00,1.00,1.00,1.00,1.00,1.00,1.00,1.00,1.00"
estampado,tipos de estampados animal print,20,,0.00,0.00,,,,"1.00,1.00,1.00,1.00,1.00,1.00,1.00,1.00,1.00,1.00,1.00,0.00"
estampado,vestido estampado animal print,20,,0.00,1.00,,,,"1.00,1.00,1.00,1.00,1.00,1.00,1.00,1.00,1.00,1.00,1.00,1.00"
estampado,vestidos estampado animal print,20,,0.00,1.00,,,,"1.00,1.00,1.00,1.00,1.00,1.00,1.00,1.00,1.00,1.00,1.00,1.00"
estampado,vestidos estampados animal print,20,,0.00,1.00,,,,"1.00,1.00,1.00,1.00,1.00,1.00,1.00,1.00,1.00,1.00,1.00,1.00"
estampado,zapatos estampados animal print,20,,0.00,0.00,,,,"1.00,1.00,1.00,1.00,1.00,1.00,1.00,1.00,1.00,1.00,1.00,0.00"
estampado,bolsos con estampado animal print,10,,0.00,0.00,,,,"0.00,1.00,0.00,0.00,1.00,1.00,0.00,0.00,0.00,0.00,0.00,0.00"
estampado,estampa animal print,10,,0.00,0.00,,,,"1.00,1.00,0.00,1.00,1.00,0.00,1.00,0.00,1.00,1.00,0.00,0.00"
estampado,estampado animal print 2019,10,,0.00,1.00,,,,"1.00,0.00,0.00,0.00,0.00,0.00,1.00,0.00,1.00,0.00,0.00,1.00"
estampado,estampado animal print 2021,10,,0.00,1.00,,,,"1.00,1.00,1.00,1.00,0.00,0.00,1.00,1.00,0.00,1.00,0.00,1.00"
estampado,estampado animal print 2023,10,,0.00,1.00,,,,"0.00,0.00,0.00,0.00,0.00,0.00,0.00,0.00,0.00,1.00,1.00,1.00"
estampado,estampado animal print para imprimir,10,,0.00,0.00,,,,"1.00,1.00,0.00,0.00,0.00,1.00,0.00,1.00,1.00,1.00,0.00,0.00"
estampado,jersey estampado animal print,10,,0.00,0.00,,,,"1.00,1.00,1.00,1.00,1.00,1.00,1.00,1.00,0.00,0.00,0.00,0.00"
estampado,pantalones estampados animal print,10,,0.00,1.00,,,,"0.00,0.00,0.00,1.00,1.00,0.00,0.00,1.00,1.00,1.00,1.00,1.00"
estampado,telas estampadas animal print,10,,0.00,0.00,,,,"1.00,1.00,0.00,1.00,0.00,1.00,1.00,1.00,0.00,0.00,0.00,0.00"
tenis,tenis new balance animal print mujer,30,,0.00,1.00,,,,"0.00,0.22,0.22,1.00,0.22,0.22,0.22,0.44,0.22,0.22,0.22,0.22"
tenis,tenis adidas animal print,20,,0.00,0.86,,,,"0.00,1.00,1.00,1.00,1.00,1.00,1.00,1.00,1.00,1.00,1.00,1.00"
tenis,tenis adidas mujer animal print,20,,0.00,0.89,,,,"0.00,1.00,1.00,1.00,1.00,1.00,0.00,1.00,1.00,1.00,1.00,1.00"
tenis,tenis animal print,20,,0.00,1.00,,,,"1.00,1.00,1.00,1.00,1.00,1.00,1.00,1.00,1.00,1.00,1.00,1.00"
tenis,tenis animal print adidas,20,,0.00,0.00,,,,"0.00,1.00,1.00,1.00,0.50,0.50,0.50,0.50,1.00,1.00,0.50,0.50"
tenis,tenis animal print mujer,20,,0.00,1.00,,,,"1.00,1.00,1.00,1.00,1.00,1.00,1.00,1.00,1.00,1.00,1.00,1.00"
tenis,tenis con animal print,20,,0.00,1.00,,,,"0.00,1.00,1.00,1.00,0.00,1.00,1.00,1.00,1.00,1.00,1.00,1.00"
tenis,tenis guess mujer animal print,20,,0.00,1.00,,,,"1.00,1.00,1.00,1.00,0.00,1.00,1.00,1.00,0.00,1.00,1.00,1.00"
tenis,tenis mujer animal print,20,,0.00,0.00,,,,"0.00,1.00,1.00,1.00,1.00,1.00,1.00,1.00,0.00,1.00,1.00,1.00"
tenis,tenis new balance animal print,20,,0.00,1.00,,,,"0.00,1.00,1.00,1.00,1.00,1.00,1.00,1.00,1.00,1.00,0.00,1.00"
tenis,tenis nike animal print,20,,0.00,1.00,,,,"0.00,0.49,0.49,0.49,0.49,0.49,0.49,1.00,0.49,0.49,0.49,0.49"
tenis,tenis plataforma animal print,20,,0.00,1.00,,,,"0.00,0.00,1.00,1.00,1.00,1.00,1.00,1.00,1.00,1.00,1.00,1.00"
tenis,tenis puma animal print,20,,0.00,1.00,,,,"1.00,1.00,1.00,1.00,1.00,1.00,0.00,1.00,1.00,1.00,1.00,1.00"
tenis,adidas animal print tenis,10,,0.00,0.00,,,,"0.00,1.00,0.00,0.00,1.00,0.00,0.00,0.00,0.00,0.00,1.00,0.00"
tenis,como combinar tenis animal print,10,,0.00,0.00,,,,"0.00,0.00,0.00,1.00,0.00,1.00,1.00,1.00,1.00,0.00,1.00,0.00"
tenis,falda animal print con tenis,10,,0.00,0.98,,,,"1.00,1.00,0.00,0.00,0.50,1.00,1.00,1.00,1.00,1.00,0.00,1.00"
tenis,faldas animal print con tenis,10,,0.00,0.98,,,,"1.00,1.00,0.00,0.00,0.00,1.00,1.00,1.00,1.00,1.00,0.00,1.00"
tenis,outfit con tenis animal print,10,,0.00,0.00,,,,"1.00,1.00,0.00,0.00,0.00,1.00,1.00,0.00,0.00,0.00,0.00,0.00"
tenis,steve madden tenis animal print,10,,0.00,0.00,,,,"1.00,0.00,0.00,0.00,0.00,0.00,1.00,1.00,1.00,0.00,1.00,0.00"
tenis,tenis adidas animal print de mujer,10,,0.00,0.00,,,,"1.00,1.00,1.00,0.00,0.00,0.00,1.00,1.00,0.00,1.00,0.00,0.00"
tenis,tenis adidas superstar animal print,10,,0.00,1.00,,,,"0.00,0.00,0.00,0.00,1.00,0.00,0.00,0.00,0.00,1.00,0.00,1.00"
tenis,tenis animal print hombre,10,,0.00,1.00,,,,"0.00,0.00,0.00,0.00,0.00,1.00,1.00,0.00,1.00,0.00,1.00,1.00"
tenis,tenis animal print nike,10,,0.00,1.00,,,,"0.00,0.00,0.00,1.00,0.00,1.00,0.00,0.00,0.00,1.00,1.00,1.00"
tenis,tenis animal print outfit,10,,0.00,0.00,,,,"0.00,0.00,0.00,0.00,0.00,1.00,1.00,1.00,1.00,0.00,0.00,0.00"
tenis,tenis animal print puma,10,,0.00,1.00,,,,"0.00,0.00,1.00,1.00,0.00,0.00,1.00,1.00,1.00,1.00,1.00,1.00"
tenis,tenis animal print steve madden,10,,0.00,0.00,,,,"0.00,0.00,0.00,0.00,0.00,1.00,1.00,1.00,1.00,1.00,1.00,0.00"
tenis,tenis animal print zara,10,,0.00,1.00,,,,"0.00,1.00,0.00,0.00,0.00,1.00,0.00,0.00,0.00,0.00,1.00,1.00"
tenis,tenis blancos con animal print,10,,0.00,1.00,,,,"0.00,0.00,0.00,1.00,1.00,0.00,0.00,1.00,1.00,1.00,1.00,1.00"
tenis,tenis fila mujer animal print,10,,0.00,0.00,,,,"1.00,1.00,1.00,1.00,0.00,1.00,1.00,1.00,1.00,0.00,0.00,0.00"
tenis,tenis vans animal print,10,,0.00,1.00,,,,"0.00,0.00,0.00,1.00,1.00,0.00,1.00,1.00,0.00,1.00,0.00,1.00"
tenis,tenis vans mujer animal print,10,,0.00,1.00,,,,"0.00,1.00,0.00,1.00,0.00,0.00,1.00,1.00,0.00,0.00,0.00,1.00"
chaqueta,chaqueta animal print,170,20,0.00,1.00,8890000,Informational,"Reviews, Image, Image pack, Related searches","0.21,0.65,1.00,1.00,1.00,1.00,0.65,0.27,0.27,0.27,0.15,0.09"
chaqueta,chaqueta animal print zara,90,25,0.00,0.99,43,Informational,"Site links, Reviews, Image, Image pack, Related searches","0.07,0.34,0.65,1.00,0.65,0.65,0.42,0.26,0.26,0.07,0.07,0.07"
chaqueta,chaquetas animal print zara,90,25,0.00,0.99,47,Informational,"Site links, Reviews, Image, Image pack, Related searches","0.07,0.34,0.65,1.00,0.65,0.65,0.42,0.26,0.26,0.07,0.07,0.07"
chaqueta,chaquetas animal print mujer,50,21,0.00,1.00,81,Informational,"Reviews, Image, Image pack, Video, Related searches","0.14,0.14,0.14,0.76,1.00,0.76,0.76,0.14,0.14,0.14,0.14,0.14"
chaqueta,chaqueta animal print mujer,40,23,0.00,1.00,99,Informational,"Reviews, Indented, Image, Image pack, Video, Related searches","0.00,0.18,0.18,0.81,0.81,1.00,0.81,0.27,0.18,0.18,0.18,0.18"
chaqueta,chaqueta punto animal print,40,15,0.00,0.00,3980000,Informational,"Reviews, Image, Image pack, Related searches","0.10,0.10,0.30,0.80,1.00,0.80,0.10,0.10,0.10,0.10,0.10,0.00"
chaqueta,animal print chaqueta,20,,0.00,0.00,,,,"1.00,1.00,1.00,1.00,1.00,1.00,1.00,1.00,1.00,1.00,0.00,0.00"
chaqueta,animal print chaquetas,20,,0.00,0.00,,,,"1.00,1.00,1.00,1.00,1.00,1.00,1.00,1.00,1.00,1.00,0.00,0.00"
chaqueta,chaqueta adidas animal print,20,,0.00,1.00,,,,"1.00,1.00,1.00,1.00,1.00,1.00,1.00,1.00,1.00,1.00,1.00,1.00"
chaqueta,chaqueta animal print hombre,20,,0.00,1.00,,,,"1.00,1.00,1.00,1.00,1.00,1.00,1.00,1.00,1.00,1.00,1.00,1.00"
chaqueta,chaqueta animal print mango,20,,0.00,0.07,,,,"1.00,1.00,1.00,1.00,1.00,1.00,1.00,1.00,1.00,0.00,1.00,1.00"
chaqueta,chaqueta animal print roja,20,,0.00,0.50,,,,"0.00,0.00,1.00,1.00,1.00,1.00,1.00,1.00,1.00,1.00,1.00,1.00"
chaqueta,chaqueta de animal print,20,,0.00,0.00,,,,"1.00,1.00,1.00,1.00,1.00,1.00,1.00,1.00,1.00,1.00,1.00,0.00"
chaqueta,chaqueta de punto animal print,20,,0.00,0.00,,,,"1.00,1.00,1.00,1.00,1.00,1.00,1.00,1.00,1.00,0.00,1.00,0.00"
chaqueta,chaqueta mujer animal print,20,,0.00,1.00,,,,"1.00,1.00,1.00,1.00,0.00,1.00,1.00,1.00,1.00,1.00,1.00,1.00"
chaqueta,chaqueta print animal,20,,0.00,1.00,,,,"1.00,1.00,1.00,1.00,1.00,1.00,1.00,1.00,1.00,1.00,0.00,1.00"
chaqueta,chaqueta punto animal print zara,20,,0.00,0.00,,,,"1.00,1.00,1.00,1.00,1.00,1.00,1.00,1.00,1.00,0.00,1.00,0.00"
chaqueta,chaquetas de animal print para mujer,20,,0.00,0.00,,,,"1.00,0.00,1.00,1.00,1.00,1.00,1.00,1.00,1.00,0.00,0.00,1.00"
chaqueta,chaquetas mujer animal print,20,,0.00,1.00,,,,"1.00,1.00,0.00,1.00,1.00,1.00,1.00,1.00,1.00,1.00,1.00,1.00"
chaqueta,combinar chaqueta animal print,20,,0.00,0.29,,,,"1.00,1.00,1.00,1.00,1.00,1.00,1.00,1.00,1.00,1.00,1.00,1.00"
chaqueta,como combinar chaqueta animal print,20,,0.00,0.00,,,,"1.00,1.00,1.00,1.00,1.00,1.00,1.00,1.00,1.00,1.00,0.00,0.00"
chaqueta,como combinar una chaqueta animal print,20,,0.00,0.00,,,,"1.00,1.00,1.00,0.00,1.00,1.00,1.00,1.00,1.00,1.00,0.00,0.00"
chaqueta,chaqueta animal print falabella,10,,0.00,0.00,,,,"0.00,1.00,1.00,0.00,0.00,1.00,0.00,0.00,0.00,0.00,0.00,0.00"
chaqueta,chaqueta animal print paris,10,,0.00,0.00,,,,"0.00,1.00,0.00,1.00,0.00,0.00,0.00,0.00,1.00,0.00,0.00,0.00"
chaqueta,chaqueta animal print stradivarius,10,,0.00,0.00,,,,"0.00,1.00,1.00,1.00,1.00,1.00,1.00,0.00,0.00,1.00,1.00,0.00"
chaqueta,chaquetas animal print,10,,0.00,1.00,,,,"0.00,0.00,0.00,1.00,0.00,0.00,0.00,0.40,0.20,0.00,0.00,0.00"
chaqueta,chaquetas de mujer animal print,10,,0.00,0.00,,,,"0.00,1.00,1.00,0.00,0.00,1.00,0.00,0.00,0.00,1.00,1.00,0.00"
chaqueta,outfit chaqueta animal print,10,,0.00,0.00,,,,"0.00,1.00,1.00,1.00,1.00,1.00,1.00,1.00,1.00,0.00,0.00,0.00"
chaqueta,outfit con chaqueta animal print,10,,0.00,0.00,,,,"0.00,0.50,0.50,0.00,1.00,1.00,1.00,1.00,1.00,0.00,0.00,0.00"
chaqueta,zara chaqueta animal print,10,,0.00,0.00,,,,"0.00,0.00,1.00,1.00,1.00,1.00,1.00,0.00,1.00,0.00,0.00,0.00"
tela,tela animal print,260,3,0.14,1.00,17800000,Informational,"Reviews, Indented, Image, Image pack, Video, Related searches, Popular products","0.43,0.54,0.54,0.54,0.43,1.00,0.81,0.66,0.43,0.43,0.29,0.29"
tela,telas animal print,70,1,0.13,1.00,5130000,Informational,"Reviews, Indented, Image, Image pack, Video, Related searches, Popular products","0.50,0.50,0.64,0.64,0.35,0.78,1.00,0.50,0.50,0.35,0.35,0.35"
tela,telas print animal,70,1,0.13,1.00,6390000,Informational,"Reviews, Image, Image pack, Video, Related searches","0.00,0.00,0.00,0.00,0.65,0.00,0.00,1.00,0.81,0.00,0.00,0.00"
tela,comprar tela animal print,20,,0.00,1.00,,,,"1.00,1.00,1.00,1.00,1.00,1.00,1.00,1.00,1.00,1.00,1.00,1.00"
tela,comprar telas animal print online,20,,0.00,1.00,,,,"1.00,1.00,1.00,1.00,1.00,1.00,1.00,1.00,1.00,1.00,1.00,1.00"
tela,tela algodón animal print,20,,0.00,1.00,,,,"1.00,1.00,1.00,1.00,1.00,1.00,1.00,1.00,1.00,1.00,1.00,1.00"
tela,tela animal print algodon,20,,0.00,1.00,,,,"1.00,1.00,1.00,1.00,1.00,1.00,1.00,1.00,0.00,1.00,0.00,1.00"
tela,tela animal print azul,20,,0.00,1.00,,,,"1.00,1.00,1.00,1.00,1.00,1.00,1.00,1.00,0.00,0.00,0.00,1.00"
tela,tela animal print cebra,20,,0.00,1.00,,,,"1.00,1.00,1.00,1.00,1.00,1.00,1.00,1.00,1.00,1.00,1.00,1.00"
tela,tela animal print colores,20,,0.00,1.00,,,,"0.50,0.00,0.00,1.00,1.00,1.00,1.00,1.00,1.00,1.00"
tela,tela animal print jirafa,20,,0.00,0.00,,,,"1.00,1.00,1.00,1.00,1.00,1.00,1.00,1.00,1.00,0.00,1.00,1.00"
tela,tela animal print leopardo,20,,0.00,1.00,,,,"1.00,1.00,1.00,1.00,1.00,1.00,1.00,1.00,1.00,1.00,1.00,1.00"
tela,tela animal print rosa,20,,0.00,0.93,,,,"1.00,1.00,1.00,1.00,1.00,1.00,1.00,1.00,1.00,1.00,1.00,1.00"
tela,tela de animal print,20,,0.00,1.00,,,,"1.00,1.00,1.00,1.00,1.00,1.00,1.00,1.00,1.00,1.00,1.00,1.00"
tela,tela estampada animal print,20,,0.00,1.00,,,,"1.00,1.00,1.00,1.00,1.00,1.00,1.00,1.00,1.00,1.00,1.00,1.00"
tela,tela estampado animal print,20,,0.00,1.00,,,,"1.00,1.00,1.00,1.00,1.00,1.00,1.00,1.00,1.00,1.00,1.00,1.00"
tela,tela lycra animal print,20,,0.00,1.00,,,,"1.00,1.00,1.00,1.00,0.00,1.00,1.00,1.00,0.00,1.00,1.00,1.00"
tela,tela peluche animal print,20,,0.00,1.00,,,,"0.00,0.00,1.00,1.00,1.00,1.00,1.00,1.00,1.00,1.00,1.00,1.00"
tela,tela seda animal print,20,,0.00,1.00,,,,"0.00,1.00,1.00,1.00,1.00,1.00,1.00,1.00,1.00,1.00,1.00,1.00"
tela,telas animal print algodón,20,,0.00,0.00,,,,"1.00,0.00,1.00,1.00,1.00,1.00,1.00,1.00,1.00,1.00,0.00,0.50"
tela,telas animal print baratas,20,,0.00,1.00,,,,"0.00,0.00,0.00,1.00,0.33,1.00,1.00,0.66,1.00,0.66,1.00,0.66"
tela,telas animal print de colores,20,,0.00,1.00,,,,"0.66,0.66,0.66,1.00,0.66,1.00,0.66,0.66,0.66,0.66,0.66,0.66"
tela,telas animal print para tapizar,20,,0.13,1.00,,,,"1.00,1.00,1.00,1.00,1.00,1.00,1.00,1.00,1.00,1.00,1.00,1.00"
tela,telas de animal print,20,,0.00,1.00,,,,"1.00,1.00,1.00,1.00,1.00,0.00,0.00,1.00,1.00,1.00,1.00,1.00"
tela,tela animal print parisina,10,,0.00,1.00,,,,"1.00,0.00,0.00,0.00,1.00,1.00,1.00,1.00,0.00,1.00,0.00,1.00"
tela,tela animal print serpiente,10,,0.00,0.00,,,,"0.00,1.00,1.00,0.00,0.00,1.00,1.00,0.00,0.00,0.00,0.00,0.00"
tela,tela animal print tigre,10,,0.00,1.00,,,,"0.00,0.00,0.00,1.00,1.00,1.00,1.00,0.00,1.00,1.00,1.00,1.00"
tela,tela animal print vaca,10,,0.00,1.00,,,,"0.00,1.00,1.00,0.00,1.00,1.00,1.00,1.00,1.00,0.00,1.00,1.00"
tela,telas animal print online,10,,0.00,0.00,,,,"1.00,1.00,1.00,0.00,1.00,1.00,0.00,0.00,0.00,0.00,0.00,0.00"
tela,telas estampadas animal print,10,,0.00,0.00,,,,"1.00,1.00,0.00,1.00,0.00,1.00,1.00,1.00,0.00,0.00,0.00,0.00"
diseño,diseño uñas animal print,110,29,0.00,1.00,79,Informational,"Reviews, Image, Image pack, Related searches","0.53,1.00,0.83,1.00,0.24,0.83,0.83,0.65,0.53,0.65,0.41,0.53"
diseño,diseño de uñas animal print,90,29,0.00,1.00,73,Informational,"Reviews, Image, Image pack, Video carousel, Related searches","0.50,0.78,0.64,0.64,0.35,1.00,0.78,0.78,0.64,0.78,0.50,0.50"
diseño,diseños de uñas animal print,90,23,0.00,1.00,73,Informational,"Reviews, Image, Image pack, Related searches","0.50,0.78,0.64,0.64,0.35,1.00,0.78,0.78,0.64,0.78,0.50,0.50"
diseño,diseño animal print,30,27,0.00,0.91,22100000,Informational,"Reviews, Indented, Image, Image pack, Video, People also ask, Related searches","1.00,0.35,0.14,0.28,0.14,0.14,0.14,0.14,0.14,0.14,0.14,0.14"
diseño,animal print diseños de uñas,20,,0.00,0.67,,,,"1.00,1.00,1.00,1.00,1.00,1.00,1.00,0.00,1.00,1.00,1.00,1.00"
diseño,diseño de animal print,20,,0.00,0.95,,,,"1.00,1.00,1.00,1.00,1.00,1.00,1.00,1.00,1.00,1.00,1.00,1.00"
diseño,diseño de uñas animal print leopardo,20,,0.00,0.81,,,,"1.00,1.00,1.00,1.00,0.00,1.00,1.00,1.00,1.00,1.00,1.00,1.00"
diseño,diseño de uñas de animal print,20,,0.00,0.00,,,,"1.00,1.00,1.00,1.00,0.00,1.00,1.00,1.00,1.00,0.00,1.00,0.00"
diseño,diseño de uñas en animal print,20,,0.00,0.00,,,,"1.00,0.50,0.50,0.00,0.50,0.50,0.50,0.50,0.50,0.50,0.50,0.00"
diseño,diseños de uñas acrilicas animal print,20,,0.00,0.00,,,,"1.00,1.00,1.00,1.00,1.00,1.00,0.00,1.00,1.00,1.00,1.00,0.00"
diseño,diseños de uñas con animal print,20,,0.00,1.00,,,,"0.00,1.00,1.00,1.00,1.00,1.00,1.00,1.00,0.00,1.00,1.00,1.00"
diseño,diseños de uñas de animal print,20,,0.00,0.99,,,,"1.00,1.00,1.00,1.00,1.00,1.00,1.00,1.00,1.00,1.00,1.00,1.00"
diseño,manicura francesa con diseño animal print,20,,0.00,1.00,,,,"1.00,1.00,1.00,1.00,1.00,1.00,1.00,1.00,1.00,1.00,1.00,1.00"
diseño,uñas diseño animal print,20,,0.00,0.98,,,,"1.00,1.00,1.00,1.00,1.00,1.00,1.00,1.00,1.00,1.00,1.00,1.00"
diseño,animal print diseño,10,,0.00,0.00,,,,"0.00,1.00,0.00,0.00,0.00,1.00,1.00,0.00,1.00,1.00,0.00,0.00"
diseño,animal print diseños,10,,0.00,0.00,,,,"0.00,1.00,0.00,0.00,0.00,1.00,1.00,0.00,1.00,1.00,0.00,0.00"
diseño,como hacer diseño animal print en uñas,10,,0.00,0.00,,,,"1.00,0.00,0.00,1.00,0.00,1.00,0.00,0.00,0.00,0.00,0.00,0.00"
diseño,como hacer diseño de animal print en las uñas,10,,0.00,0.00,,,,"0.00,0.00,1.00,0.00,0.00,0.00,0.00,1.00,1.00,0.00,0.00,0.00"
diseño,diseño animal print para uñas,10,,0.00,0.00,,,,"1.00,0.00,0.00,0.00,0.00,0.00,1.00,0.00,1.00,0.00,1.00,1.00"
diseño,diseño de animal print en uñas,10,,0.00,0.00,,,,"0.00,1.00,0.00,1.00,0.00,1.00,1.00,0.00,1.00,1.00,1.00,0.00"
diseño,diseño de uñas acrilicas animal print,10,,0.00,1.00,,,,"0.00,0.00,0.00,0.00,0.00,1.00,0.00,1.00,0.00,1.00,0.00,1.00"
diseño,diseño de uñas animal print paso a paso,10,,0.00,0.00,,,,"1.00,0.00,0.00,0.00,0.00,0.00,1.00,1.00,0.00,0.00,1.00,0.00"
diseño,diseños animal print para uñas,10,,0.00,0.00,,,,"1.00,0.00,0.00,0.00,0.00,0.00,1.00,0.00,1.00,0.00,1.00,1.00"
diseño,diseños de animal print en uñas,10,,0.00,0.00,,,,"1.00,1.00,0.00,1.00,0.00,1.00,1.00,0.00,1.00,1.00,1.00,0.00"
diseño,diseños de uñas animal print cebra,10,,0.00,0.00,,,,"1.00,0.00,0.00,0.00,0.00,0.00,0.00,1.00,1.00,0.00,0.00,0.00"
diseño,diseños de uñas de animal print pies,10,,0.00,0.00,,,,"1.00,0.00,1.00,0.00,0.00,1.00,0.00,1.00,0.00,0.00,1.00,0.00"
diseño,diseños de uñas en animal print,10,,0.00,0.00,,,,"0.00,0.00,1.00,0.00,0.00,1.00,1.00,0.00,1.00,0.00,1.00,0.00"
diseño,diseños de uñas para pies animal print,10,,0.00,0.00,,,,"1.00,1.00,1.00,0.00,0.00,0.00,0.00,0.00,1.00,0.00,0.00,0.00"
diseño,manicure diseños animal print,10,,0.00,1.00,,,,"1.00,0.00,0.00,1.00,1.00,1.00,0.00,0.00,1.00,0.00,1.00,1.00"
fondo,fondo animal print,140,25,0.00,0.73,71,Informational,"Reviews, Image, Image pack, Video, People also ask, Related searches","0.66,1.00,1.00,0.66,0.52,0.82,1.00,0.66,0.52,0.43,0.43,0.52"
fondo,fondos animal print tumblr,90,21,0.00,0.27,19,Informational,"Image, Image pack, People also ask, Related searches","0.83,1.00,0.83,0.65,0.53,0.65,0.41,0.24,0.24,0.24,0.18,0.11"
fondo,fondo de pantalla animal print,70,21,0.00,0.19,51,Informational,"Reviews, Image, Image pack, Related searches","0.50,1.00,0.78,0.50,0.50,0.63,0.35,0.50,0.35,0.28,0.28,0.13"
fondo,fondos de pantalla animal print,70,21,0.00,0.13,52,Informational,"Reviews, Image, Image pack, Video, Related searches","0.64,1.00,0.79,0.49,0.49,0.64,0.36,0.49,0.36,0.28,0.28,0.13"
fondo,fondo de pantalla animal print rosado,50,20,0.00,0.00,36,Informational,"Reviews, Indented, Image, Image pack, Related searches","0.11,0.11,0.11,0.11,0.11,0.52,1.00,0.11,0.64,0.11,0.11,0.11"
fondo,fondos animal print,50,21,0.00,0.78,62,Informational,"Reviews, Image, Image pack, Video, Related searches","0.71,1.00,1.00,0.57,0.57,0.71,0.71,0.57,0.71,0.43,0.57,0.57"
fondo,animal print fondo leopardo,20,,0.00,0.11,,,,"1.00,1.00,1.00,1.00,1.00,1.00,1.00,1.00,1.00,1.00,1.00,1.00"
fondo,fondo animal print cebra,20,,0.00,0.63,,,,"1.00,1.00,1.00,1.00,1.00,1.00,1.00,1.00,1.00,1.00,1.00,1.00"
fondo,fondo animal print fucsia,20,,0.00,0.00,,,,"1.00,1.00,1.00,1.00,1.00,1.00,1.00,0.00,1.00,0.00,1.00,0.00"
fondo,fondo animal print leopardo,20,,0.00,0.83,,,,"1.00,1.00,1.00,1.00,1.00,1.00,1.00,1.00,1.00,1.00,1.00,1.00"
fondo,fondo animal print rojo,20,,0.00,0.18,,,,"1.00,1.00,1.00,1.00,1.00,1.00,1.00,0.00,1.00,1.00,1.00,1.00"
fondo,fondo animal print rosa,20,,0.00,0.17,,,,"1.00,1.00,1.00,1.00,1.00,1.00,1.00,1.00,1.00,1.00,1.00,1.00"
fondo,fondo cebra animal print,20,,0.00,0.00,,,,"1.00,0.00,1.00,1.00,0.00,0.00,1.00,1.00,1.00,1.00,1.00,1.00"
fondo,fondos animal print cebra,20,,0.00,0.63,,,,"1.00,1.00,1.00,1.00,1.00,1.00,1.00,1.00,1.00,1.00,1.00,1.00"
fondo,fondos animal print jirafa,20,,0.00,0.00,,,,"1.00,1.00,1.00,1.00,1.00,1.00,1.00,1.00,1.00,1.00,1.00,1.00"
fondo,fondos animal print rosa,20,,0.00,0.17,,,,"1.00,1.00,1.00,1.00,1.00,1.00,1.00,1.00,1.00,1.00,1.00,1.00"
fondo,fondos de animal print,20,,0.00,0.74,,,,"1.00,1.00,1.00,1.00,1.00,1.00,1.00,1.00,1.00,1.00,1.00,1.00"
fondo,fondos de pantalla animal print cebra,20,,0.00,0.00,,,,"1.00,1.00,1.00,1.00,0.00,1.00,1.00,1.00,1.00,1.00,1.00,1.00"
fondo,fondos de pantalla animal print rosa,20,,0.00,0.00,,,,"1.00,1.00,1.00,1.00,1.00,1.00,1.00,1.00,1.00,1.00,1.00,1.00"
fondo,animal print fondo,10,,0.00,0.73,,,,"1.00,0.33,0.67,0.00,0.00,0.67,0.00,0.00,1.00,0.00,0.00,0.00"
fondo,animal print fondos,10,,0.00,0.73,,,,"1.00,1.00,0.66,0.00,0.00,0.33,0.00,1.00,0.00,0.00,0.00,0.00"
fondo,fondo animal print png,10,,0.00,0.00,,,,"1.00,1.00,1.00,1.00,0.00,0.00,1.00,0.00,1.00,0.00,1.00,1.00"
fondo,fondo de animal print rosa,10,,0.00,0.00,,,,"1.00,0.00,0.00,1.00,0.00,0.00,0.00,0.00,0.00,1.00,0.00,1.00"
fondo,fondo leopardo animal print,10,,0.00,0.00,,,,"1.00,0.00,1.00,0.00,1.00,1.00,1.00,1.00,1.00,1.00,0.00,0.00"
fondo,fondos animal print hd,10,,0.00,0.00,,,,"1.00,1.00,1.00,0.00,1.00,0.00,0.00,1.00,0.00,1.00,0.00,0.00"
fondo,fondos de animal print rosa,10,,0.00,0.00,,,,"1.00,0.00,0.00,1.00,0.00,0.00,0.00,0.00,0.00,1.00,0.00,1.00"
fondo,fondos de pantalla de animal print,10,,0.00,0.19,,,,"0.49,1.00,1.00,0.00,0.00,0.74,0.00,0.00,0.00,0.00,0.00,0.00"
fondo,imagenes de animal print para fondo de pantalla,10,,0.00,0.00,,,,"1.00,1.00,0.00,1.00,0.00,1.00,0.00,0.00,1.00,0.00,0.00,1.00"
bag,animal print bag,20,,0.00,1.00,,,,"1.00,1.00,1.00,1.00,1.00,1.00,1.00,1.00,1.00,1.00,1.00,1.00"
bag,animal print tote bag,20,,0.00,1.00,,,,"1.00,1.00,0.00,1.00,1.00,1.00,0.50,1.00,1.00,0.00,1.00,1.00"
bag,louis vuitton animal print bag,20,,0.00,1.00,,,,"1.00,1.00,1.00,0.00,1.00,1.00,1.00,1.00,0.00,1.00,1.00,1.00"
bag,michael kors animal print bag,20,,0.00,0.86,,,,"1.00,1.00,1.00,1.00,1.00,1.00,0.00,0.00,1.00,0.00,1.00,1.00"
bag,tote bag animal print,20,,0.00,1.00,,,,"1.00,1.00,1.00,1.00,1.00,1.00,1.00,1.00,1.00,1.00,1.00,1.00"
bag,animal print bag uk,10,,0.00,0.00,,,,"0.00,1.00,0.00,1.00,0.00,1.00,0.00,0.00,1.00,0.00,0.00,0.00"
bag,animal print beach bag,10,,0.00,0.00,,,,"1.00,0.50,0.00,0.50,0.50,0.00,1.00,1.00,0.00,1.00,0.00,0.00"
bag,animal print clutch bag,10,,0.00,1.00,,,,"0.00,1.00,0.00,1.00,0.00,0.00,0.00,0.00,0.00,1.00,0.00,1.00"
bag,animal print crossbody bag,10,,0.00,1.00,,,,"0.00,0.00,0.00,1.00,1.00,0.00,0.00,1.00,0.00,0.00,0.00,1.00"
bag,animal print crossbody bags,10,,0.00,1.00,,,,"0.00,0.50,0.00,1.00,1.00,0.50,0.00,1.00,0.00,0.00,0.00,1.00"
bag,animal print leather bags,10,,0.00,0.00,,,,"0.00,0.50,0.50,0.00,0.00,1.00,0.50,0.50,0.50,0.00,0.50,0.00"
bag,animal print messenger bag,10,,0.00,0.00,,,,"0.50,1.00,0.00,0.00,0.00,0.00,1.00,1.00,1.00,0.00,0.00,0.00"
bag,animal print shopper bag,10,,0.00,0.00,,,,"1.00,0.00,0.00,1.00,1.00,0.00,0.00,0.00,0.00,0.00,0.00,0.00"
bag,animal print tote bag zara,10,,0.00,1.00,,,,"0.00,1.00,1.00,0.00,1.00,0.00,0.00,1.00,0.00,0.00,0.00,1.00"
bag,bag animal print,10,,0.00,1.00,,,,"1.00,0.00,0.00,1.00,1.00,1.00,0.00,0.00,1.00,1.00,0.00,1.00"
bag,balenciaga animal print bag,10,,0.00,0.00,,,,"0.00,1.00,1.00,1.00,0.00,0.00,0.00,0.00,0.00,0.00,0.00,0.00"
bag,christian dior animal print bag,10,,0.00,1.00,,,,"0.00,1.00,1.00,0.00,0.00,0.00,0.00,1.00,1.00,0.00,1.00,1.00"
bag,dior animal print bag,10,,0.00,0.00,,,,"1.00,0.00,0.00,0.00,1.00,0.00,1.00,1.00,1.00,0.00,0.00,0.00"
bag,dior tote bag animal print,10,,0.00,0.21,,,,"0.00,1.00,0.00,0.00,0.00,1.00,0.00,0.00,1.00,0.00,1.00,1.00"
bag,furla animal print bag,10,,0.00,0.00,,,,"1.00,1.00,1.00,0.00,1.00,1.00,1.00,0.00,1.00,0.00,0.00,0.00"
bag,ganni animal print bag,10,,0.00,0.00,,,,"0.00,0.00,0.50,0.00,0.00,0.50,1.00,1.00,0.00,0.00,1.00,0.00"
bag,leather animal print bag,10,,0.00,1.00,,,,"0.00,0.00,0.00,0.00,1.00,0.00,0.00,0.00,1.00,0.00,0.00,1.00"
bag,longchamp animal print bag,10,,0.00,0.00,,,,"0.00,1.00,1.00,0.00,1.00,1.00,1.00,1.00,0.00,1.00,0.00,0.00"
bag,parfois animal print bag,10,,0.00,0.00,,,,"0.00,1.00,1.00,1.00,1.00,1.00,1.00,1.00,0.00,0.00,0.00,0.00"
bag,prada animal print bag,10,,0.00,0.00,,,,"0.00,0.00,0.00,0.00,1.00,1.00,1.00,0.00,1.00,1.00,1.00,0.00"
bag,vans animal print bag,10,,0.00,0.00,,,,"0.00,1.00,1.00,0.00,0.00,1.00,0.00,0.00,1.00,0.00,0.00,0.00"
bag,ysl animal print bag,10,,0.00,0.00,,,,"0.00,0.00,1.00,1.00,1.00,1.00,1.00,1.00,1.00,0.00,0.00,0.00"
camiseta,camiseta animal print,170,13,0.30,1.00,19900000,Informational,"Reviews, Indented, Image, Image pack, Related searches","0.26,0.53,0.65,0.42,0.26,0.53,0.53,0.65,0.80,0.80,1.00,0.65"
camiseta,camisetas animal print mujer,140,23,0.32,1.00,94,Informational,"Reviews, Indented, Image, Image pack, Video, Related searches","0.15,0.28,0.53,1.00,0.43,0.28,0.53,0.81,0.34,0.28,0.53,0.21"
camiseta,camiseta animal print zara,70,26,0.00,1.00,38,"Informational, Transactional","Site links, Reviews, Image, Image pack, Related searches","0.21,0.50,0.78,0.14,1.00,0.14,0.14,0.78,0.78,0.78,1.00,0.50"
